search,acuenta,eltit,eltrebol,jumbo,santaisabel,unimarc,price_acuenta,pre_discount_acuenta,price_eltit,pre_discount_eltit,price_eltrebol,pre_discount_eltrebol,price_jumbo,pre_discount_jumbo,price_santaisabel,pre_discount_santaisabel,price_unimarc,pre_discount_unimarc
arroz,Arroz Grado 2 Bolsa 1Kg Tucapel,Arroz Pregraneado Tucapel 1Kg,Tucapel Arroz Tucapel Pregraneado G°1 kg,Tucapel Arroz Grado 2 Tucapel Gran Selección Grano Largo y Ancho 1 kg,Tucapel Arroz Grado 2 Tucapel Blue Grano Largo y Delgado 1 kg,Arroz tucapel pregraneado 1 kg,1950.0,1950.0,2199.0,2199.0,1690.0,2190.0,2150.0,2150.0,1490.0,1790.0,2140.0,2830.0
arroz,Arroz Grado 2 Bolsa 1Kg Tucapel,Arroz Pregraneado Tucapel 1Kg,Tucapel Arroz Tucapel Pregraneado G°1 kg,Tucapel Arroz Grado 2 Tucapel Gran Selección Grano Largo y Ancho 1 kg,Tucapel Arroz Grado 2 Tucapel Blue Grano Largo y Delgado 1 kg,Arroz tucapel pregraneado 1 kg,1890.0,1890.0,2199.0,2199.0,1690.0,2190.0,2150.0,2150.0,1490.0,1790.0,2140.0,2830.0
arroz,Arroz Preparado Primavera Bolsa 210grs Tucapel...,Arroz Especial Preparado Primavera Tucapel 210Gr,Miraflores Arroz Miraflores Primavera 210 gr,Miraflores Arroz Preparado Primavera 210 g,Miraflores Arroz Preparado Primavera 210 g,Arroz preparado miraflores primavera 210 g,950.0,950.0,890.0,890.0,1490.0,1490.0,990.0,1170.0,950.0,1150.0,1030.0,1210.0
manzanas,Acondicionador Manzana Papaya Bio 750 ml Famila...,Acondicionador Mazana Papaya Familand 750Ml,Familand Acondicionador Familand Manzana Papaya 750 ml,Familand Acondicionador Familand Manzana y Papaya 750 ml,Familand Acondicionador Familand Manzana y Papaya 750 ml,Acondicionador familand granada uvaterapia 750 ml,1990.0,1990.0,1799.0,1799.0,1590.0,1990.0,2220.0,2220.0,2190.0,2190.0,2190.0,2190.0
sal,Sal Parrillera 750grs Lider,Sal Parillera Salero Lobos 750Gr,Sal Lobos Sal Lobos Parrillera 750 gr,Lobos Sal Parrillera Lobos Yodada Frasco 750 g,Cuisine & Co Sal Parrillera 750 g,Sal parrillera lobos 750 g,1350.0,1350.0,1399.0,1399.0,1590.0,1590.0,1650.0,1650.0,990.0,1370.0,1260.0,1650.0
sal,Mantequilla con Sal 250grs Colun,Mantequilla Con Sal Chilolac 250Gr,Colun Mantequilla Colun S/Sal 250 Gr,Colun Mantequilla Colun Con Sal 250 g,Colun Mantequilla Colun Con Sal 250 g,Mantequilla colun con sal pan 250 g,2750.0,2750.0,2750.0,2750.0,3190.0,3190.0,3329.0,3329.0,2590.0,3279.0,3150.0,3150.0
sal,Mantequilla con Sal 250grs Lider,Mantequilla Con Sal Chilolac 250Gr,Colun Mantequilla Colun S/Sal 250 Gr,Soprole Mantequilla Soprole Con Sal 250 g,Soprole Mantequilla Soprole Con Sal 250 g,Mantequilla soprole con sal 250 g,2550.0,2550.0,2750.0,2750.0,3190.0,3190.0,2590.0,3099.0,3049.0,3049.0,2550.0,3100.0
sal,Mantequilla Sin Sal 250grs Colun,Mantequilla Colun Pan 250Gr,Colun Mantequilla Colun S/Sal 250 Gr,Colun Mantequilla Colun Con Sal 250 g,Colun Mantequilla Colun Sin Sal 250 g,Mantequilla colun sin sal pan 250 g,3490.0,3490.0,2990.0,2990.0,3190.0,3190.0,3329.0,3329.0,3000.0,3499.0,3970.0,3970.0
sal,Mantequilla Con Sal 250 g Calo,Mantequilla Con Sal De Mar Soprole 250 Gr,Calo Mantequilla Calo Pan 250 gr,Colun Mantequilla Colun Con Sal 250 g,Calo Mantequilla Calo Con Sal 250 g,Mantequilla calo con sal pan 250 g,2790.0,2790.0,3090.0,3090.0,3290.0,3290.0,3329.0,3329.0,3149.0,3149.0,2990.0,2990.0
sal,Mantequilla Con Sal 250 g Soprole,Mantequilla Con Sal De Mar Soprole 250 Gr,Soprole Mantequilla Soprole Sal De Mar 250 Gr,Soprole Mantequilla Soprole Con Sal 250 g,Soprole Mantequilla Soprole Con Sal 250 g,Mantequilla soprole con sal 250 g,2890.0,2890.0,3090.0,3090.0,3190.0,3190.0,2590.0,3099.0,3049.0,3049.0,2550.0,3100.0
sal,Mantequilla Sin Sal Pan 250grs Soprole,Mantequilla Sin Sal Soprole 250Gr,Soprole Mantequilla Soprole Pan S/Sal 250 Gr,Soprole Mantequilla Soprole Con Sal 250 g,Soprole Mantequilla Soprole Sin Sal 250 g,Mantequilla soprole sin sal 250 g,2690.0,2690.0,3090.0,3090.0,3190.0,3190.0,2590.0,3099.0,3299.0,3299.0,3375.0,3740.0
sal,Mantequilla con Sal 250grs Los Alerces,Mantequilla Los Alerces 250Gr,Los Alerces Mantequilla Los Alerces Pan 250 Gr,Soprole Mantequilla Soprole Con Sal 250 g,Los Alerces Mantequilla Los Alerces Con Sal 250 g,Mantequilla fundo los alerces con sal pan 250 g,2890.0,2890.0,2990.0,2990.0,2990.0,2990.0,2590.0,3099.0,3399.0,3399.0,3690.0,3690.0
sal,Acondicionador Sin Sal Granada 750ml Ballerina...,Acondicionador Palta Ballerina 750ml,Ballerina Acondicionador Ballerina Sin Sal Granada Frasco 750 ml,Ballerina Acondicionador Ballerina Manzanilla 750 ml,Ballerina Acondicionador Ballerina Granada 750 ml,Acondicionador ballerina sin sal granada doypack 750 ml,1950.0,1950.0,1795.0,1795.0,1690.0,1690.0,1590.0,1820.0,1490.0,1790.0,1810.0,1810.0
sal,Acondicionador Moringa Sin Sal 750ml Familand...,Acondicionador Mazana Papaya Familand 750Ml,Familand Acondicionador Familand Doypack Moringa 750 ml,Familand Acondicionador Familand Granada Uva 750 ml,Familand Acondicionador Familand Granada Uva 750 ml,Acondicionador familand granada uvaterapia 750 ml,1750.0,1750.0,1799.0,1799.0,1390.0,1390.0,2220.0,2220.0,2190.0,2190.0,2190.0,2190.0
azúcar,Azúcar Blanca 1Kg Acuenta,Azúcar Dama Blanca 1Kg,Dama Blanca Azúcar Dama Blanca 1 Kg,Iansa Azúcar Blanca Iansa 1 kg,Iansa Azúcar Blanca Iansa 1 kg,Azúcar blanca iansa 1 kg,1090.0,1090.0,1399.0,1399.0,1490.0,1490.0,1490.0,1490.0,1470.0,1470.0,1490.0,1490.0
azúcar,Azúcar Flor 500grs Iansa,Azúcar Flor Iansa 500Gr,Iansa Azúcar Flor Iansa 500 gr,Iansa Azúcar Flor Iansa 500 g,Iansa Azúcar Flor Iansa 500 g,Azúcar flor iansa 500 g,1150.0,1150.0,1299.0,1299.0,1390.0,1390.0,1290.0,1290.0,990.0,1270.0,1090.0,1290.0
azúcar,Azúcar Flor 500grs Lider,Azúcar Flor Iansa 500Gr,Iansa Azúcar Flor Iansa 500 gr,Iansa Azúcar Flor Iansa 500 g,Iansa Azúcar Flor Iansa 500 g,Azúcar flor iansa 500 g,1090.0,1090.0,1299.0,1299.0,1390.0,1390.0,1290.0,1290.0,990.0,1270.0,1090.0,1290.0
azúcar,Azúcar Rubia Bolsa 500grs Iansa,Azúcar Rubia Iansa 500Gr,Iansa Azúcar Rubia Iansa 500 gr,Iansa Azúcar Rubia Iansa 500 g,Iansa Azúcar Rubia Iansa 500 g,Azúcar rubia iansa 500 g,1100.0,1290.0,1399.0,1399.0,1390.0,1390.0,1090.0,1390.0,990.0,1370.0,1430.0,1430.0
aceite,Aceite De Maravilla 1 L Chef,Aceite de Maravilla Chef 1L,Chef Aceite Chef Maravilla 1 L,Chef Aceite de Maravilla Chef 1 L,Chef Aceite de Maravilla Chef 1 L,Aceite chef maravilla 0% colesterol 1 l,2750.0,2750.0,2990.0,2990.0,3590.0,3590.0,3710.0,3710.0,3690.0,3690.0,2900.0,3590.0
aceite,Aceite Maravilla 900 ml Lider,Aceite Maravilla Parral 900Ml,Parral Aceite Parral Maravilla 900 ml,Cuisine & Co Aceite de Maravilla 900 ml,Cuisine & Co Aceite de Maravilla 900 ml,Aceite natura maravilla 100% 900 ml,1700.0,1700.0,2099.0,2099.0,1990.0,2390.0,1990.0,2450.0,2430.0,2430.0,2300.0,3290.0
aceite,Aceite Vegetal 900 ml Natura,Aceite Vegetal Belmont 900Ml,Natura Aceite Natura Vegetal 900 ml,Cuisine & Co Aceite Vegetal Libre de Colesterol 900 ml,Cuisine & Co Aceite Vegetal Libre de Colesterol 900 ml,Aceite vegetal natura 900 ml,2450.0,2450.0,2790.0,2790.0,2590.0,2590.0,1850.0,1850.0,1790.0,1790.0,1880.0,2850.0
mantequilla,Mantequilla con Sal 250grs Colun,Mantequilla Con Sal Chilolac 250Gr,Colun Mantequilla Colun S/Sal 250 Gr,Colun Mantequilla Colun Con Sal 250 g,Colun Mantequilla Colun Con Sal 250 g,Mantequilla colun con sal pan 250 g,2750.0,2750.0,2750.0,2750.0,3190.0,3190.0,3329.0,3329.0,2590.0,3279.0,3150.0,3150.0
mantequilla,Mantequilla con Sal 250grs Lider,Mantequilla Con Sal Chilolac 250Gr,Colun Mantequilla Colun S/Sal 250 Gr,Soprole Mantequilla Soprole Con Sal 250 g,Soprole Mantequilla Soprole Con Sal 250 g,Mantequilla soprole con sal 250 g,2550.0,2550.0,2750.0,2750.0,3190.0,3190.0,2590.0,3099.0,3049.0,3049.0,2550.0,3100.0
mantequilla,Mantequilla Con Sal 250 g Calo,Mantequilla Con Sal De Mar Soprole 250 Gr,Calo Mantequilla Calo Pan 250 gr,Colun Mantequilla Colun Con Sal 250 g,Calo Mantequilla Calo Con Sal 250 g,Mantequilla calo con sal pan 250 g,2790.0,2790.0,3090.0,3090.0,3290.0,3290.0,3329.0,3329.0,3149.0,3149.0,2990.0,2990.0
mantequilla,Mantequilla Con Sal 250 g Soprole,Mantequilla Con Sal De Mar Soprole 250 Gr,Soprole Mantequilla Soprole Sal De Mar 250 Gr,Soprole Mantequilla Soprole Con Sal 250 g,Soprole Mantequilla Soprole Con Sal 250 g,Mantequilla soprole con sal 250 g,2890.0,2890.0,3090.0,3090.0,3190.0,3190.0,2590.0,3099.0,3049.0,3049.0,2550.0,3100.0
mantequilla,Mantequilla Sin Sal Pan 250grs Soprole,Mantequilla Sin Sal Soprole 250Gr,Soprole Mantequilla Soprole Pan S/Sal 250 Gr,Soprole Mantequilla Soprole Con Sal 250 g,Soprole Mantequilla Soprole Sin Sal 250 g,Mantequilla soprole sin sal 250 g,2690.0,2690.0,3090.0,3090.0,3190.0,3190.0,2590.0,3099.0,3299.0,3299.0,3375.0,3740.0
mantequilla,Mantequilla Sin Sal 250grs Colun,Mantequilla Colun Pan 250Gr,Colun Mantequilla Colun S/Sal 250 Gr,Colun Mantequilla Colun Con Sal 250 g,Colun Mantequilla Colun Sin Sal 250 g,Mantequilla colun sin sal pan 250 g,3490.0,3490.0,2990.0,2990.0,3190.0,3190.0,3329.0,3329.0,3000.0,3499.0,3970.0,3970.0
mantequilla,Mantequilla con Sal 250grs Los Alerces,Mantequilla Los Alerces 250Gr,Los Alerces Mantequilla Los Alerces Pan 250 Gr,Soprole Mantequilla Soprole Con Sal 250 g,Los Alerces Mantequilla Los Alerces Con Sal 250 g,Mantequilla fundo los alerces con sal pan 250 g,2890.0,2890.0,2990.0,2990.0,2990.0,2990.0,2590.0,3099.0,3399.0,3399.0,3690.0,3690.0
sopa pollo,Sopa Pollo Con Sémola 68 g Maggi,Sopa Sabor Pollo con Sémola Maggi 68Gr,Maggi Sopa Maggi Pollo Semola 68 gr,Maggi Sopa Maggi Pollo con Sémola 68 g,Maggi Sopa Maggi Pollo con Sémola 68 g,Sopa maggi pollo con sémola sobre 68 g,550.0,550.0,599.0,599.0,749.0,749.0,620.0,620.0,610.0,610.0,500.0,590.0
avena,Avena Instantánea 700grs Lider,Avena Quaker Instantánea 700Gr,Quaker Avena Instantánea Quaker 700 Grs,Quaker Avena Instantánea Quaker 700 g,Quaker Avena Instantánea Quaker 700 g,Avena quaker instantánea 700 g,2150.0,2150.0,2990.0,2990.0,2090.0,2490.0,2699.0,2699.0,2659.0,2659.0,2790.0,2790.0
yogurt,Yoghurt Proteína Natural 155 g Soprole,Yogurt Protein Frutilla Soprole 155Gr,Soprole Yogurt Soprole Protein+ Natural 155 gr,Soprole Yogurt Soprole Proteína Natural 155 g,Soprole Yogurt Soprole Proteína Natural 155 g,Yoghurt soprole proteína natural 155 g,640.0,640.0,850.0,850.0,749.0,749.0,729.0,729.0,719.0,719.0,600.0,690.0
yogurt,Yoghurt Proteína Frutilla 155 g Soprole,Yogurt Protein Frutilla Soprole 155Gr,Soprole Yogurt Soprole Protein + Frutilla 155 gr,Soprole Yogurt Soprole Proteína Frutilla 155 g,Soprole Yogurt Soprole Proteína Frutilla 155 g,Yoghurt soprole proteína frutilla 155 g,640.0,640.0,850.0,850.0,749.0,749.0,729.0,729.0,719.0,719.0,600.0,690.0
jalea,Jalea Frambuesa Postre 100grs Colun,Jalea Frambuesa Colun 100Gr,Colun Jalea Colun Frambuesa 100 Gr,Colun Jalea Colun Frambuesa 100 g,Colun Jalea Colun Frambuesa 100 g,Jalea colun frambuesa pote 100 g,290.0,290.0,299.0,299.0,299.0,299.0,310.0,310.0,309.0,309.0,258.0,300.0
jalea,Jalea Piña 110 g Soprole,Jalea Piña Soprole 110Gr,Soprole Jalea Soprole Piña 110 Gr,Soprole Jalea Soprole Piña 110 g,Soprole Jalea Soprole Piña 110 g,Jalea piña soprole 110 g,300.0,300.0,299.0,299.0,399.0,399.0,325.0,325.0,319.0,319.0,250.0,310.0
jalea,Jalea Guinda Postre 100 g Colun,Jalea Guinda Colun 100Gr,Colun Jalea Colun Guinda 100 Gr,Colun Jalea Colun Guinda 100 g,Colun Jalea Colun Guinda 100 g,Jalea colún guinda 100 g,290.0,290.0,299.0,299.0,299.0,299.0,310.0,310.0,309.0,309.0,258.0,300.0
harina,Harina Tostada 500 g,Harina Kunstman Tostada 500 Gr,Oso Harina Tostada Oso 500 Grs,Oso Harina Tostada Oso 500 g,Kunstmann Harina Tostada Kunstmann 500 g,Harina tostada dimme 500 g,1190.0,1190.0,599.0,599.0,1290.0,1290.0,1280.0,1280.0,1170.0,1170.0,1560.0,1560.0
harina,"Harina De Fuerza 1 kg, Collico",Harina Collico 1Kg,Collico Harina Collico Fuerza 1 Kg,Collico Harina Collico de Fuerza 1 kg,Collico Harina Collico de Fuerza 1 kg,Harina collico todo uso 1 kg,1690.0,1690.0,1099.0,1099.0,1390.0,1390.0,1460.0,1460.0,1440.0,1440.0,1490.0,1490.0
harina,Harina Integral 1kg Selecta,Harina Integral Selecta 1Kg,Selecta Harina Selecta Integral 1 Kg,Selecta Harina Integral Selecta 1 kg,Selecta Harina Integral Selecta 1 kg,Harina selecta integral 1 kg,1690.0,1990.0,2290.0,2290.0,2690.0,2690.0,2090.0,2090.0,2070.0,2070.0,2290.0,2290.0
agua,"Agua Mineral con Gas 1,6L Cachantun",Agua Mineral Mas Manzana Cachantún 1.6Lt,Cachantun Cachantun Con Gas botella 1.6 L,Cachantun Agua Mineral Cachantun Strong con Gas 1.6 L,Cachantun Agua Mineral Cachantun Strong con Gas 1.6 L,Agua mineral cachantun con gas 1.6 l,990.0,990.0,990.0,990.0,999.0,999.0,1150.0,1150.0,1090.0,1090.0,763.0,1110.0
leche,Leche Semidescremada 1 L Lider,Leche Semidescremada Colun 1Lt,Soprole Leche Soprole Semidescremada 1 Litro,Cuisine & Co Leche Cuisine & Co Semidescremada 1 L,Soprole Leche Semidescremada Soprole con Avena 1 L,Leche soprole semidescremada con avena 1 l,990.0,990.0,1299.0,1299.0,1290.0,1290.0,1099.0,1099.0,1469.0,1469.0,1530.0,1530.0
leche,Leche Sabor Chocolate Semidescremada 1L Soprole...,Leche Semidescremada Sabor Chocolate Loncoleche 1Lt,Soprole Leche Soprole Semidescremada 1 Litro,Cuisine & Co Leche Cuisine & Co Semidescremada 1 L,Soprole Leche Soprole Semidescremada Chocolate 1 L,Leche semidescremada soprole chocolate 1 l,1490.0,1490.0,1890.0,1890.0,1290.0,1290.0,1099.0,1099.0,1659.0,1659.0,1417.0,1590.0
leche,Leche Semidescremada Natural 1 L Soprole,Leche Natural Descremada Soprole 1Lt,Soprole Leche Soprole Semidescremada 1 Litro,Cuisine & Co Leche Cuisine & Co Semidescremada 1 L,Soprole Leche Soprole Semidescremada Natural 1 L,Leche semidescremada natural soprole 1 l,1150.0,1150.0,1199.0,1199.0,1290.0,1290.0,1099.0,1099.0,1269.0,1269.0,1090.0,1250.0
leche,Leche Descremada Natural 1 L Soprole,Leche Natural Descremada Soprole 1Lt,Soprole Leche Soprole Descremada 1 Litro,Soprole Leche Soprole Sin Lactosa Descremada 1 L,Soprole Leche Soprole Descremada Natural 1 L,Leche descremada natural soprole 1 l,1150.0,1150.0,1199.0,1199.0,1290.0,1290.0,1269.0,1269.0,1269.0,1269.0,1090.0,1250.0
leche,Leche Sabor Frutilla Semidescremada 1L Soprole...,Leche Semidescremada Sabor Frutilla Loncoleche 1Lt,Soprole Leche Soprole Semidescremada 1 Litro,Cuisine & Co Leche Cuisine & Co Semidescremada 1 L,Soprole Leche Soprole Semidescremada Frutilla 1 L,Leche semidescremada soprole frutilla 1 l,1490.0,1490.0,1890.0,1890.0,1290.0,1290.0,1099.0,1099.0,1659.0,1659.0,1417.0,1590.0
virutilla,Yoghurt Proteína Frutilla 155 g Soprole,Yogurt Protein Frutilla Soprole 155Gr,Soprole Yogurt Soprole Protein + Frutilla 155 gr,Soprole Yogurt Soprole Proteína Frutilla 155 g,Soprole Yogurt Soprole Proteína Frutilla 155 g,Yoghurt soprole proteína frutilla 155 g,640.0,640.0,850.0,850.0,749.0,749.0,729.0,729.0,719.0,719.0,600.0,690.0
virutilla,Leche Sabor Frutilla Semidescremada 1L Soprole...,Leche Semidescremada Sabor Frutilla Loncoleche 1Lt,Soprole Leche Soprole Semidescremada 1 Litro,Cuisine & Co Leche Cuisine & Co Semidescremada 1 L,Soprole Leche Soprole Semidescremada Frutilla 1 L,Leche semidescremada soprole frutilla 1 l,1490.0,1490.0,1890.0,1890.0,1290.0,1290.0,1099.0,1099.0,1659.0,1659.0,1417.0,1590.0
acondicionador,Acondicionador Largo Increible 750ml Ballerina...,Acondicionador Palta Ballerina 750ml,Ballerina Acondicionador Ballerina Carbón 750 ml,Ballerina Acondicionador Ballerina Manzanilla 750 ml,Ballerina Acondicionador Ballerina Largo Increíble Doypack 750 ml,Acondicionador ballerina largo increíble 750 ml,1990.0,1990.0,1795.0,1795.0,1690.0,1690.0,1590.0,1820.0,1490.0,1790.0,1900.0,1900.0
acondicionador,Acondicionador Coco Jazmín 750ml Ballerina...,Acondicionador Palta Ballerina 750ml,Ballerina Acondicionador Ballerina Carbón 750 ml,Ballerina Acondicionador Ballerina Coco y Jazmín 750 ml,Ballerina Acondicionador Ballerina Carbón Frasco 750 ml,Acondicionador ballerina manzanilla doypack 750 ml,1950.0,1950.0,1795.0,1795.0,1690.0,1690.0,2090.0,2090.0,2050.0,2050.0,1810.0,1810.0
acondicionador,Acondicionador Detox Hierbas 750 ml Ballerina...,Acondicionador Detox Ballerina 750ml,Ballerina Acondicionador Ballerina Carbón 750 ml,Ballerina Acondicionador Ballerina Ondas y Rizos 750 ml,Ballerina Acondicionador Ballerina Granada 750 ml,Acondicionador ballerina largo increíble 750 ml,1950.0,1950.0,1795.0,1795.0,1690.0,1690.0,1590.0,1820.0,1490.0,1790.0,1900.0,1900.0
acondicionador,Acondicionador Sin Sal Granada 750ml Ballerina...,Acondicionador Palta Ballerina 750ml,Ballerina Acondicionador Ballerina Sin Sal Granada Frasco 750 ml,Ballerina Acondicionador Ballerina Manzanilla 750 ml,Ballerina Acondicionador Ballerina Granada 750 ml,Acondicionador ballerina sin sal granada doypack 750 ml,1950.0,1950.0,1795.0,1795.0,1690.0,1690.0,1590.0,1820.0,1490.0,1790.0,1810.0,1810.0
acondicionador,Acondicionador Granada Uvaterapia Botella 750ml...,Acondicionador Palta Ballerina 750ml,Familand Acondicionador Familand Arandano Uvaterapia 750 ml,Familand Acondicionador Familand Granada Uva 750 ml,Ballerina Acondicionador Ballerina Granada 750 ml,Acondicionador familand granada uvaterapia 750 ml,1750.0,1750.0,1795.0,1795.0,1590.0,1990.0,2220.0,2220.0,1490.0,1790.0,2190.0,2190.0
acondicionador,Acondicionador Moringa Sin Sal 750ml Familand...,Acondicionador Mazana Papaya Familand 750Ml,Familand Acondicionador Familand Doypack Moringa 750 ml,Familand Acondicionador Familand Granada Uva 750 ml,Familand Acondicionador Familand Granada Uva 750 ml,Acondicionador familand granada uvaterapia 750 ml,1750.0,1750.0,1799.0,1799.0,1390.0,1390.0,2220.0,2220.0,2190.0,2190.0,2190.0,2190.0
acondicionador,Acondicionador Manzana Papaya Bio 750 ml Famila...,Acondicionador Mazana Papaya Familand 750Ml,Familand Acondicionador Familand Manzana Papaya 750 ml,Familand Acondicionador Familand Manzana y Papaya 750 ml,Familand Acondicionador Familand Manzana y Papaya 750 ml,Acondicionador familand granada uvaterapia 750 ml,1990.0,1990.0,1799.0,1799.0,1590.0,1990.0,2220.0,2220.0,2190.0,2190.0,2190.0,2190.0
bolsa basura,Bolsa de Basura Mediana 70x90 cm 10 Un Virutex...,Bolsa Basura Mediana 70x90Cm 10 Unidades Virutex,Virutex Bolsas De Basura Biorollo Virutex 80x110 cm 10 und,Virutex Bolsa de Basura Virutex Bio Mediana 70 x 90 cm 10 un.,Virutex Bolsa de Basura Virutex Bio Mediana 70 x 90 cm 10 un.,Bolsa de basura virutex mediana (70x90 cm) rollo 10 un,1090.0,1090.0,1299.0,1299.0,1890.0,1890.0,1250.0,1250.0,1190.0,1190.0,1090.0,1330.0
bolsa basura,Bolsa de Basura 50x70cms 10 Un Lider,Bolsa Basura Pequeña Eltit 50X70Cm 10 Unidades,Superior Bolsa de Basura Superior 80x110 cms. Rollo 10 und,Superior Bolsa de Basura Superior Rollo 50 x 70 cm 10 un.,Superior Bolsa de Basura Superior Rollo 50 x 70 cm 10 un.,Bolsa de basura impeke reciclado 50x70 cm 10 un,650.0,650.0,599.0,599.0,1590.0,1790.0,780.0,780.0,600.0,770.0,700.0,700.0
bolsa basura,Bolsa de Basura Pequeña 50x70 cm 10 Un Superior...,Bolsa Basura Pequeña Virutex 50x70Cm 10 Unidades,Superior Bolsa de Basura Superior 80x110 cms. Rollo 10 und,Superior Bolsa de Basura Superior 70 x 90 cm 10 un.,Superior Bolsa de Basura Superior 70 x 90 cm 10 un.,Bolsa de basura smart clean 50x70 cm 10 un,610.0,610.0,690.0,690.0,1590.0,1790.0,1250.0,1250.0,1190.0,1190.0,610.0,610.0
cloro,Cloro En Gel Original 900 ml Clorox,Cloro Gel Clorinda 900Ml,Clorox Cloro Gel Original Clorox 900 Ml,Clorox Cloro Gel Clorox Original 900 ml,Clorox Cloro Gel Clorox Original 900 ml,Cloro gel clorox original 900 ml,1990.0,1990.0,1899.0,1899.0,2990.0,2990.0,2190.0,2190.0,1690.0,2150.0,1800.0,2250.0
cloro,Cloro Gel tradicional 900ml Lider,Cloro Gel Tradicional Impeke 900Ml,Impeke Cloro Gel Impeke Tradicional 900 ml,Igenix Cloro Gel Igenix Tradicional 900 ml,Igenix Cloro Gel Igenix Tradicional 900 ml,Cloro gel impeke tradicional 900 ml,1450.0,1450.0,1399.0,1399.0,1890.0,1890.0,1990.0,1990.0,1950.0,1950.0,1660.0,1660.0
cloro,Cloro Gel Aroma Floral 900ml Lider,Cloro Gel Clorinda 900Ml,Impeke Cloro Gel Impeke Aroma Limón 900 ml,Igenix Cloro Gel Igenix Floral 900 ml,Igenix Cloro Gel Igenix Floral 900 ml,Cloro gel igenix floral 900 ml,1750.0,1750.0,1899.0,1899.0,1890.0,1890.0,1990.0,1990.0,1950.0,1950.0,1770.0,2070.0
cloro,Cloro Gel Aroma Limón 900ml Lider,Cloro Gel Limón Impeke 900Ml,Impeke Cloro Gel Impeke Aroma Limón 900 ml,Home Care Cloro Gel Home Care Limón 900 ml,Home Care Cloro Gel Home Care Limón 900 ml,Cloro gel smart clean limón 900 ml,1750.0,1750.0,1399.0,1399.0,1890.0,1890.0,1890.0,1890.0,1850.0,1850.0,1750.0,1750.0
servilleta,Servilleta Cóctel 200 Un Lider,Servilleta Una Hoja Cóctel Elite 200 Unidades,Elite Servilleta Elite Cóctel Una Hoja 200 Unidades,Elite Servilletas Elite Cóctel 200 un.,Elite Servilletas Elite Cóctel 200 un.,Servilleta cóctel nubelin 200u,2190.0,2190.0,1690.0,1690.0,1590.0,1790.0,1990.0,2290.0,1990.0,2250.0,1500.0,2130.0
