search,found,price,pre_discount
arroz,Tucapel Arroz Tucapel Basmati Kilo,5090,5090
arroz,Miraflores Arroz Miraflores Primavera 210 gr,1490,1490
arroz,Tucapel Arroz Tucapel Chaufán 210 gr,949,949
arroz,Miraflores Arroz Miraflores Champiñón 210 gr,1490,1490
arroz,Miraflores Arroz Miraflores Curry 210 gr,1490,1490
arroz,Miraflores Arroz Miraflores Arabe 175 gr,1490,1490
arroz,Tucapel Arroz Tucapel Risotto Kilo,4590,4590
arroz,Banquete Arroz Banquete Multigrano 400 gr,1690,1690
arroz,Miraflores Arroz Miraflores Chaufán 210 gr,1490,1490
arroz,Tucapel Galleta Arroz Dulce Tucapel 25Grs,399,399
arroz,Real Thai Papel Arroz Real Thai 22 cm,1990,1990
arroz,Los Granos Arroz Los Granos Importado G2 Kilo,1000,1590
arroz,Banquete Arroz Banquete Premium Gº2 kg,2390,2390
pasta,Divella Pasta Farfalle Divella 500 Grs,2090,2090
pasta,Fresh Up Pasta dental Fresh Up Regular 130 Grs,899,1190
pasta,Colgate Pasta Dental Colgate Ultra Branco 90 Grs,1290,1290
pasta,Carozzi Pasta Para Uno Carozzi Bolognesa 70 gr,1290,1290
pasta,Pepsodent Pasta Dental Pepsodent Charcoal 75 ml,1000,1290
pasta,Trattoria Pasta Trattoria Arroz 250 Grs,2590,2590
pasta,Pepsodent Pasta Dental Pepsodent Herbal Gum Care 75 ml,1000,1290
pasta,Fresh Up Pasta dental Fresh Up Whitening Pack 3 x 90 Grs,2000,2490
pasta,Lucchetti Pasta Pronta Lucchetti Caracol Queso 296 gr,1890,1890
pasta,Carozzi Pasta Para Uno Carozzi Caracoqueso 70 gr,1290,1290
pasta,Pepsodent Pasta Dental Pepsodent Triple Acción 90 Grs,1000,1290
pasta,Minuto Verde Pasta De Choclo Minuto Verde Kg,3000,3890
pasta,Receta del Abuelo Pasta Pollo F/ Hierbas R/Abuelo 125 Gr,1390,1390
pasta,Fresh Up Pasta Dental Fresh Up Regular Pack 3 x 90 Grs,2290,2290
pasta,Fresh Up Pasta Fresh Up Triple Accion 150 Grs,1490,1490
pasta,Colgate Colgate Pasta Total-Clean Mint D 195 gr,4290,4290
pasta,Oral B Pasta Dental Oral B Kids Mickey 50 Gr,1000,1490
pasta,Receta del Abuelo Pasta De Jamón Serrano Receta del Abuelo 125 gr,1090,1090
pasta,Mulpun Pasta Mulpun Ajo Horneada 140 Grs,3990,3990
pasta,Fresh Up Gel Dental Fresh Up Kids 75 ml,1090,1090
pasta,Fresh Up KIT Dental Gel Fresh Up 125grs + Hilo + Cepillo,2390,2390
porotos,Bonanza Poroto Bonanza Tortola Kilo,3790,3790
porotos,Wasil Porotos Wasil Negro Tetra 380 Grs,1390,1390
porotos,Wasil Porotos Wasil Rojos Tetra 380 Grs,1390,1390
porotos,Bonanza Porotos Bonanza Hallado kg,2990,2990
porotos,Banquete Poroto Banquete Español Kilo,4190,4190
porotos,Banquete Porotos Banquete Tortola kg,4590,4590
porotos,Bonanza Porotos Bonanza Negro Kg,2490,2490
porotos,Banquete Poroto Banquete Hallado Kilo,4290,4290
porotos,Los Granos Porotos Los granos Hallado kilo,2590,3190
porotos,Wasil Porotos Wasil Granados Tetra 380 Grs,1790,2190
porotos,Los Granos Porotos Los Granos Tórtola Kilo,4160,4160
porotos,Wasil Porotos Wasil Blanco Tetra 380 Grs,1390,1390
porotos,Los Granos Porotos Los Granos Pelado Kilo,2690,2690
porotos,Frutos del Maipo Porotos Granados Frutos Del Maipo 500 Gr,3490,3490
porotos,Frutos del Maipo Porotos Verdes Frutos Del Maipo 350 gr,1990,1990
porotos,Receta del Abuelo Hamburguesa Burger Porotos Negros Receta del Abuelo 100 gr,1090,1090
porotos,Minuto Verde Porotos Verdes C/Frances Minuto Verde 350 Grs,1890,1890
porotos,Los Granos Porotos Los Granos Blanco Kilo,2890,2890
manzanas,De la zona Manzana Verde Kilo,1990,1990
manzanas,De la zona Manzana Royal Gala kilo,1890,1890
manzanas,Vivo Mifrut Vivo Manzana 90Gr,699,699
manzanas,Airwick Airwick Elect Recarga Manzana Canela 21 ml,6590,6590
manzanas,Surlat Probiótico Surlat Manzana Sin Lactosa 4x80 ml,1000,1290
manzanas,Lysol Limpiador Lysol Manzana 900Ml,1690,2190
manzanas,Traverso Vinagre Traverso Manzana 500 cc,1790,1790
manzanas,Cachantun Cachantun Más Manzana 600 cc,799,1190
manzanas,De la zona Manzana Roja Frutalan Malla kilo,1790,1790
palta,Ilicit Mascara Capilar Ilicit Keratin Palta 350Ml ,5390,5390
palta,De la zona Palta Hass Granel kilo,5990,5990
palta,Ballerina Acondicionador Ballerina Palta-Almendras 750 ml,1690,1690
palta,Ballerina Acondicionador Ballerina Sin Sal Palta Almendra Doypack 900 ml,1590,1590
palta,Ballerina Shampoo Ballerina Palta/Almendra 750 ml,1690,1690
sal,Sal Lobos Sal Lobos Parrillera 750 gr,1590,1590
sal,Sal Lobos Sal Lobos Fina Doypack Kilo,949,949
sal,Sal Lobos Sal Lobos Cocina Kilo,649,649
sal,Sal Lobos Sal Lobos Mesa Pote 850 Grs,1590,1590
sal,Sal Lobos Sal Lobos Light Doypack Kilo,3590,3590
sal,Biosal Sal Biosal Doypack 400 Grs,1690,1690
sal,Doña Prospera Sal Doña Prospera Natural Molinillo 140 Grs,3690,3690
sal,Doña Prospera Sal Doña Prospera Himalaya Salero 100 gr,1690,1690
sal,KA Sal Himalaya Ka Grano Fino 130 Grs,1690,1690
sal,Biosal Sal Biosal Mesa Pote 850 Grs,4590,4590
sal,Finish Finish Sal 1 Kilo,3090,3090
sal,Doña Prospera Sal Doña Prospera Himalaya Gruesa Dp 400 Grs,3290,3290
sal,Specia Sal Ajo Pimienta Specia Frasco 300 gr,1890,1890
sal,Doña Prospera Sal Doña Prospera C/Ajo Dp 370 Grs,1990,1990
sal,Doña Prospera Sal Doña Prospera C/Merken Dp 370 Grs,1990,1990
sal,Doña Prospera Sal Doña Prospera C/Oregano Molinillo 140 Grs,3690,3690
sal,Rumay Mantequilla C/Sal Rumay 200 Gr,3290,3290
sal,Colun Mantequilla Colun S/Sal 250 Gr,3190,3190
sal,Soprole Mantequilla Soprole Pan S/Sal 250 Gr,3190,3190
sal,Soprole Mantequilla Soprole Pan C/Sal 250 Gr,2790,2790
sal,Lays Papas Lays Artesanas C/Sal 150 gr,1990,1990
sal,El Trebol Mani Sin Sal El Trebol 160 gr,999,999
sal,Soprole Mantequilla Arte Soprole C/Sal 250 Gr,3190,3190
sal,Millantue Maní Millantue S/Sal 200 Grs,1590,1590
sal,Evercrisp Maní Evercrisp Sin Sal 140 Grs,999,1190
sal,Huingan Quesillo Huingan C/Sal 450 Grs,3290,3290
sal,Ballerina Acondicionador Ballerina Sin Sal Granada Frasco 750 ml,1690,1690
sal,Soprole Mantequilla Soprole Sal De Mar 250 Gr,3190,3190
sal,Ballerina Acondicionador Ballerina Sin sal Granada Doypack 900 ml,1590,1590
sal,Ballerina Acondicionador Ballerina Sin Sal Palta Almendra Doypack 900 ml,1590,1590
sal,Ballerina Acondicionador Ballerina Sin sal Coco Jazmin Doypack 900 cc,1690,1690
sal,PuriPop PuriPop Popcorn Oliva Sal De Mar 100 Grs,2790,2790
sal,El Trebol Maní Con Pasas Con Sal El Trébol 160 gr,1190,1190
sal,El Trebol Maní Con Pasas Sin Sal El Trébol 160 gr,1190,1190
sal,Ballerina Shampoo Ballerina Doypack Sin sal Coco Jazmin 900 ml,1590,1590
sal,Sal Lobos Salero Lobos 250 Grs,899,899
sal,Biosal Salero Biosal 125 Grs,1390,1390
sal,Biosal Salero Biosal Bajo Sodio 250 Grs,2590,2590
sal,Biosal Salero Biosal 500 Grs,3490,3490
azúcar,Iansa Azúcar Rubia Iansa 500 gr,2290,2290
azúcar,Iansa Azúcar Iansa Bolsa 3 Kilos,4000,5190
azúcar,Dama Blanca Azúcar Dama Blanca 1 Kg,1490,1490
azúcar,Iansa Azúcar blanca granulada Iansa 1 kg,1490,1490
azúcar,Iansa Azúcar blanca granulada Iansa 5 kg,7490,7490
azúcar,La Patrona Azúcar La Patrona 5 Kilos,6990,6990
azúcar,El Monarca Azúcar De Caña El Monarca 1 kilo,1000,1290
azúcar,Nutrabien Brownie Nutrabien Sin Azúcar 250 gr,2490,2490
azúcar,Red Bull Red Bull Sin Azúcar 250 cc,1390,1890
azúcar,Coca Cola Coca Cola Sin Azúcar Lata 350 cc,999,999
azúcar,Watts Mermelada Watts Sin Azúcar Damasco 200 grs,1490,1490
azúcar,Neucober Cremonella Neucober Vegana Sin Azúcar 650 grs,7690,7690
azúcar,Coca Cola Coca Cola Sin Azucar Desechable 1.5 Lts,2390,2390
azúcar,Coca Cola Tripack Coca/Sprite Sin Azúcar 3L,7000,8990
aceite,Miraflores Aceite Miraflores Vegetal 900 cc,2000,2790
aceite,Belmont Aceite Belmont Canola 1 L,4590,4590
aceite,Mazola Aceite Mazola Maíz 1 L,5590,5590
aceite,Chef Aceite Chef Maravilla 1 L,3590,3590
aceite,Miraflores Aceite Miraflores Maravilla 900 cc,2490,2990
aceite,Chef Aceite Chef Maiz 1 L,5390,5390
aceite,Natura Aceite Natura Maravilla 900 cc,2990,2990
aceite,Parral Aceite Parral Maravilla 900 ml,2000,2390
aceite,Belmont Aceite Belmont Vegetal 1 L,2790,2790
aceite,Natura Aceite Natura Vegetal 900 ml,2590,2590
huevo,El Monte Huevos El Monte Blanco Docena,4390,4390
jamon,La Crianza Jamón Ahumado Camp Crianza 200 Grs,2690,2690
jamon,La Crianza Jamón Pierna Campestre Crianza 200 Gr,2690,2690
jamon,Llanquihue Jamón Pierna LLanquihue G2 150 Grs,2390,2390
jamon,Chillán Pate Teewurst Jamon Chillan 140Grs,1390,1390
jamon,San Jorge Jamon Colonial San Jorge 200 Gr,2990,2990
jamon,PF Jamón Colonial Pf 125 gr,2390,2390
jamon,Selz Galleta Selz Mini Jamon 35Grs,399,399
jamon,Receta del Abuelo Jamon Pierna Receta Del Abuelo 200 Gr,3190,3190
jamon,San Jorge Fiambre Jamon Sandwich San Jorge 250 Gr,1990,1990
jamon,Receta del Abuelo Jamón Serrano R/Abuelo 65 Grs,2190,2190
jamon,La Preferida Jamon Serrano La Preferida 80 Grs,3890,3890
jamon,San Jorge Jamón Planchado San Jorge 200 grs,2290,2290
queso,Huilco Queso Crema Huilco 190 Gr,1790,1990
queso,Philadelphia Queso Crema Philadelphia 180 Grs,3690,3690
queso,Quillayes Queso Camembert Quillayes 100 Gr,3190,3190
queso,Soprole Queso Brie Soprole 125 Grs,3190,3190
queso,Colun Queso Fresco Colun 320 Gr,2490,2490
queso,Colun Queso Ranco Colun Lam 150 gr SR,2290,2290
queso,Colun Queso Ranco Colun Laminado 150 Gr,2190,2190
queso,Soprole Queso Parmesano Soprole 40 Gr,1090,1090
queso,Soprole Queso Parmesano Soprole 80 Gr,2190,2190
queso,Colun Queso Crema Colun Natural 100 Grs,1690,1690
queso,Colun Queso Rallado Colun Parmes 40 Gr,999,999
queso,Colun Queso Rallado Colun Regg 40 Gr,999,999
queso,Los Alpes Queso Los Alpes Camembert 125 Grs,3390,3390
queso,Soprole Queso Crema Soprole Natural 200 G,1590,1590
queso,Colun Queso Crema Colun Ciboulette 200 Gr,1690,1690
queso,Runca Queso Mantecoso Runca 220 Grs,3290,3290
queso,Runca Queso Runka Granulado 500 Gr,5990,5990
queso,Colun Queso Gouda Lam Colun 150 Gr,2190,2190
queso,Colun Queso Rallado Colun Parmes 80 Grs,1790,1790
queso,Soprole Queso Quilque Mantecoso 150 Gr,2290,2290
queso,Colun Queso Rallado Colun Regg 80 Grs,1890,1890
queso,Quillayes Queso Chanco Laminado Quillayes 150 Gr,2590,2590
queso, Queso Gauda Laminado Huilco 400 gr,3890,3890
queso,Colun Queso Edam Laminado Colun 250 Grs,3590,3590
queso, Queso Mantecoso Laminado Huilco 400 gr,4000,4490
queso,Quillayes Queso Untable Quillayes Natural 140 Gr,1290,1290
queso,Quillayes Queso Gauda Laminado Quillayes 150 Gr,1990,1990
queso,Colun Queso Crema Colun Tomate Orégano 100 Grs,1690,1690
queso,Evercrisp Doritos Queso 200 gr,1690,2090
queso,Huilco Queso Gauda Laminado Huilco 250 gr,2790,2790
queso,Colun Queso Ranco Colun Laminado 250 Gr,3190,3190
queso,Evercrisp Dorito Queso 285 grs,3190,3190
queso, Queso Chanco Laminado Huilco 400 gr,3990,3990
queso,Los Tilos Queso Cabra Natural Los Tilos 200 Grs,5490,5490
queso,La Vaquita Queso Cream Cheese La Vaquita 227 Gr,3090,3090
queso,La Vaquita Queso Gauda Lam La Vaquita 500 Gr,6090,6090
queso,La Vaquita Queso Gauda Gran La Vaquita 250 gr,3190,3190
queso,Colun Queso Crema Colun Ajo/Albahaca 100 Grs,1690,1690
queso,Colun Queso Crema Colun Cebolla Salteada 100 Grs,1690,1690
queso,Colun Queso Fresco Light Colun 400 Gr,2890,2890
queso,La Vaquita Queso Mantecoso Laminado La Vaquita 500 Grs,6490,6490
queso,La Vaquita Queso Mantecoso Laminado La Vaquita 250 grs,3490,3490
queso,Evercrisp Ramitas Evercrisp Queso 230 gr,1590,2090
queso,La Vaquita Queso Gauda La Vaquita Lam 400 Gr,4990,4990
queso,Carozzi Tortellini Carozzi Queso 400 gr,3090,3090
queso,Frutillar Queso Crema Frutillar 100 Grs,899,899
queso,La Vaquita Queso Crema La Vaquita 100 grs,849,849
queso,Los Tilos Queso de Cabra Los Tilos Orégano 200 Grs,6290,6290
mantequilla,Calo Mantequilla Calo Untab 350 gr,4990,4990
mantequilla,Surlat Mantequilla Surlat Pan 200 gr,2000,2390
mantequilla,Kumey Mantequilla Kumey 250 Grs,3290,3290
mantequilla,Calo Mantequilla Calo Pan 250 gr,3290,3290
mantequilla,Colun Mantequilla Colun Pan 125 Gr,1690,1690
mantequilla,Soprole Mantequilla Soprole Pan 125 Gr,1590,1590
mantequilla,Soprole Mantequilla Untable Soprole 200 Grs,3690,3690
mantequilla,Calo Mantequilla Calo Pan 125 Grs,1690,1690
mantequilla,Colun Mantequilla Colun Pan 250 Grs,2990,2990
mantequilla,Colun Mantequilla Colun Pote 200 Gr,3290,3290
mantequilla,La Vaquita Mantequilla La Vaquita 250 Gr,3690,3690
mantequilla,Loncoleche Mantequilla Lonco S/Colest 250Grs,3190,3190
mantequilla,President Mantequilla President 200 Grs. Pan,2890,2890
mantequilla,Colun Mantequilla Colun S/Sal 250 Gr,3190,3190
mantequilla,Los Alerces Mantequilla Los Alerces Pan 125 Gr,1690,1690
mantequilla,Los Alerces Mantequilla Los Alerces Pan 250 Gr,2990,2990
mantequilla,Soprole Mantequilla Soprole Sal De Mar 250 Gr,3190,3190
mantequilla,Rumay Mantequilla C/Sal Rumay 200 Gr,3290,3290
mantequilla,Soprole Mantequilla Arte Soprole C/Sal 250 Gr,3190,3190
mantequilla,Soprole Mantequilla Soprole Pan S/Sal 250 Gr,3190,3190
mantequilla,Soprole Mantequilla Soprole Pan C/Sal 250 Gr,2790,2790
mantequilla,Costa Galleta Costa Mantequilla 140 Grs,749,749
mantequilla,Mckay Galleta Mckay Mantequilla 140 Grs,1090,1090
salsa tomates,Robinson Crusoe Sardinas Robinson Crusoe Salsa Tomate 125 gr,1690,1690
sopa pollo,Maggi Sopa Maggi Pollo Arroz 70Grs,599,849
sopa pollo,Maggi Sopa Maggi Pollo Fideos 70 grs,599,849
sopa pollo,Maggi Sopa Maggi Pollo Semola 68 gr,599,849
sopa pollo,Traverso Sopa Fideos Traverso Pollo 65 gr,1190,1190
sopa pollo,Maggi Sopa Maggi Consome Pollo 50 grs,599,849
sopa pollo,Gourmet Sopa Gourmet Pollo Fideos 70 Grs,549,549
sopa pollo,Traverso Sopa Fideos Traverso Pollo 85 gr,599,599
sopa pollo,Vitelli Sopa Vitelli Pollo Vaso 65 gr,799,799
vacuno,Super Beef Churrasco Vacuno Superbeef 120 gr,1000,1290
vacuno,King Hamburguesa Vacuno K/Kong 185G,1090,1090
vacuno,Llanquihue Hamburguesa Vacuno Llanquihue 125 Gr,1390,1390
vacuno,Llanquihue Hamburguesa Vacuno Llanquihue 55 Grs,599,599
vacuno,PF Churrasco De Vacuno PF 120 gr,1590,1590
vacuno,Super Beef Hamburguesa Vacuno Super Beef 100 grs,699,699
vacuno,King Churrasco Vacuno King 90 Gr,899,899
vacuno,Montina Churrasco Vacuno Montina 120 Gr,1290,1290
vacuno,Llanquihue Churrasco Vacuno Llanquihue 90 Gr,1590,1590
vacuno,Receta del Abuelo Hamburguesa Vacuno Receta del Abuelo 100 Gr,1090,1090
vacuno,Nestle Picado Nestle Cazuela Vacuno 250 Grs,2890,2890
vacuno,La Preferida Hamburguesa La Preferida Vacuno 100 Grs,1190,1190
vacuno,Receta del Abuelo Hamburguesa Vacuno Receta del Abuelo Bacon 100 gr,1090,1090
vacuno,La Crianza Hamburguesa Vacuno La Crianza 150 gr,1390,1390
vacuno,La Crianza Hamburguesa La Crianza Vacuno Premium 100 Grs,999,999
vacuno,Receta del Abuelo Churrasco De Vacuno R/Abuelo 120 Gr,2090,2090
vacuno,Receta del Abuelo Escalopa Kayser Vacuno Jamon Queso 120 Gr,1190,1190
vacuno,Receta del Abuelo Hamburguesa Vacuno R/Abuelo Americano 100 Grs,1090,1090
vacuno,La Crianza Hamburguesa Vacuno Ligth La Crianza 100 Grs,1090,1090
filetitos,Super pollo Filetitos De Pollo 700 Gr,5490,5490
filetitos,Ariztia Pechuga Pollo Desh Ariztia Bolsa 700 Gr,7190,7190
filetitos,Sadia Pechuga Pollo Sadia Kg,6890,6890
filetitos,Super pollo Medallita Super Pollo 100 Grs,799,799
filetitos,Super pollo Tiritas De Pechuga Super Pollo 700 gr,6190,6190
filetitos,Super pollo Pechuga Deshuesada Pollo 700 Gr,5690,5690
avena,Quaker Avena Instantánea Quaker 700 Grs,2000,2690
avena,Vivo Avena Vivo Instantánea 700 Grs,1890,2390
avena,Quaker Avena Quaker Instantánea 400 gr,2190,2190
avena,Quaker Avena Tradicional Quaker 700 grs,2000,2690
avena,Nestum Nestum Avena Arroz 250 Grs,2790,2790
avena,Simonds Jabón Simonds Dermo Avena Dp 750 cc,1390,2190
avena,Simonds Jabón Simonds Avena Dermo 500 ml,2490,2490
avena,Ecovida Galleta Ecovida Avena Shock 140 Grs,2090,2090
avena,Simonds Crema Simond's Dermocream Humectante Avena 150 ml,1690,1690
avena,Quaker Galletón Quaker Avena Arandano 40 gr,499,499
avena,Vivo Tortilla Vivo Wrap con avena 264 gr,1990,1990
avena,Dermocream Dermocream Humect Avenas Oranicas 400 ml,4990,4990
avena,Ballerina Jabón Ballerina Avena D/P 750 ml,1590,1590
pan,Soprole Mantequilla Soprole Pan S/Sal 250 Gr,3190,3190
pan,El Trebol Pan Ciabatta Trebol Unidad,2990,2990
pan,El Trebol Pan Italiano Trebol Unidad,2790,2790
pan,Ideal Pan Ideal Hamburguesa 520 grs,2890,2890
pan,El Trebol Pan Hamburguesa Trébol Granel Kilo,2690,2690
pan,El Trebol Pan Corriente Trebol Unidad,2090,2090
pan,Casa Masa Pan Hamburguesa 6 Unidades,1390,1390
pan,Casa Masa Pan Frances Casa Masa,2990,2990
pan,El Trebol Pan Copihue Granel Kilo,2690,2690
pan,Ideal Pan Pita Ideal Blanco 300 Gr,1690,1690
pan,Ideal Pan Hotdog Ideal 8 Unidades,2290,2290
pan,Casa Masa Pan Francés Precocido 4 Unidades,1690,1690
pan,Ideal Pan Rayado Ideal 250 Gr,1390,1390
pan,Surlat Mantequilla Surlat Pan 200 gr,2000,2390
pan,Ideal Pan Blanco Ideal Xl 750 Gr,2590,2590
pan,Castaño Pan Blanco Familiar Castaño 570 Grs,2490,2490
pan,Castaño Pan Pita Blanco Castaño 300 Grs,1790,1790
pan,Sureña Margarina Soprole Pan 250 Gr,1390,1390
pan,Calo Mantequilla Calo Pan 250 gr,3290,3290
pan,Colun Mantequilla Colun Pan 125 Gr,1690,1690
pan,Next Margarina Next Pan 250 Grs,1390,1390
pan,Pamperita Margarina Pamperita Pan 250 Grs,1290,1290
pan,President Mantequilla President 200 Grs. Pan,2890,2890
pan,Eckart Dulce Membrillo Eckart Pan 500 Grs,2090,2090
pan,Crucina Manteca Crucina Pan 200 Grs,1990,1990
pan,Soprole Mantequilla Soprole Pan 125 Gr,1590,1590
pan,Calo Mantequilla Calo Pan 125 Grs,1690,1690
pan,Colun Mantequilla Colun Pan 250 Grs,2990,2990
pan,Sureña Margarina Soprole Pan 125 Gr,699,699
pan,Casa Masa Pan De Pascua Casa Masa 500 Grs,2690,2690
pan,Los Alerces Mantequilla Los Alerces Pan 125 Gr,1690,1690
pan,Los Alerces Mantequilla Los Alerces Pan 250 Gr,2990,2990
pan,Soprole Mantequilla Soprole Pan C/Sal 250 Gr,2790,2790
pan,Castaño Pan Coctel Mini Toast Castaño 90 Grs,2390,2390
pan,Stuttgart Pan Molde Stuttgart Integral 650 Grs,2890,2890
pan,Casa Masa Hallulla Precocida 9 Unidades,1990,1990
café,Gold Café Gold 170 gr,6000,6990
café,Monterrey Café Monterrey 100 gr,4190,4190
café,Monterrey Café Monterrey 50 gr,2790,2790
café,Gold Café Gold 50 gr,3290,3290
café,Gold Café Gold 100 gr,6290,6290
café,Monterrey Café Monterrey 170 gr,5890,5890
café,Gold Café Gold Excelso 250 gr,6490,6490
café,Gold Café Gold Forte 250 gr,7290,7290
café,Gold Café Gold Descafeinado 170 gr,10290,10290
café,Gold Café Gold Descafeinado 50 gr,3990,3990
café,Gold Café Gold Descafeinado 100 gr,7890,7890
café,Gold Café Gold Descafeinado 250 gr,8490,8490
café,El Trebol Café El Trébol Liofilizado 170 gr,6690,6690
café,Gold Café Gold Premier Frasco 170 gr,9690,9690
café,Gold Café Gold Premier Frasco 50 gr,3790,3790
café,El Trebol Café El Trébol Liofilizado 100 gr,3490,4190
café,En Linea Café En Linea Con Leche 104 gr,2790,2790
café,El Trebol Café El Trébol Granulado Descafeinado 170 gr,6690,6690
café,El Trebol Café El Trébol Granulado Clásico 170 gr,5000,5000
café,Monterrey Café Monterrey Grano Molido Moka 250 Grs,6090,6090
café,El Trebol Café El Trébol Granulado Clásico 100 gr,3000,3490
café,Nugget Betún Nugget Café 65 ml,2190,2190
café,Virginia Betún Líquido Virginia Café 60 ml,2790,2790
café,Nugget Betún Líquido Nugget Café 60 ml,3290,3290
café,Colun Leche Colun Café Cappuccino 330 Cc,899,1090
café,Kahlua Licor Kahlua Cafe 20° 750 cc,9990,9990
café,Colun Leche Colun Café Caramelo 330 Cc,899,1090
café,En Linea Café En Linea Vainilla 104 gr,2790,2790
café,Ecco Ecco 100 Grs,3090,3090
café,Coronado Coronado 100 Grs.,2390,2390
café,Nescafe Nescafe Dolca 50 Grs,2690,2690
café,Nescafe Nescafe Tradicion Dawn 170Grs,10190,10190
café,Nescafe Nescafe Tradicion Frasco 100 Grs,6390,6390
café,Nescafe Nescafe Dolca 100 Grs,5190,5190
café,Nescafe Nescafé Tradición 170 gr,6990,6990
café,Nescafe Nescafé Dolca 195 grs,6690,6690
café,Nescafe Nescafe Tradicion 50 Grs,3690,3690
café,Nescafe Nescafe Fina Selección Frasco 100 Grs,8790,8790
café,Nescafe Nescafé Dolca 170 gr,5190,5190
café,Ecco Ecco 170 gr,2890,3690
café,Ecco Ecco 50 Grs,1890,1890
café,Nescafe Nescafe Tradicion 100 Grs,6490,6490
café,Nescafe Nescafé Fina Selección Frasco 200 Grs,9000,12990
café,Nescafe Nescafe Fina Selección Frasco 50 Grs,5190,5190
café,Nescafe Nescafé Tradición 210 Grs,6000,6990
té,Te Supremo Té Supremo Especial 250 gr,1890,1890
té,Te China Té China Verde 20 Bolsitas,1390,1390
té,Lipton Te Lipton Verde 20Bls,3290,3290
té,Superior Té Superior Ceylan 250 Grs,3390,3390
té,Superior Té Superior Ceylan 125 Grs,2090,2090
yogurt,Colun Yogurt Protein Plus Frutilla 190 gr,1290,1290
yogurt,Nestle Yogurt Chamyto Sin Azúcar Vainilla 115 gr,399,399
yogurt,Calan Yogurt Calan Vainilla 110 grs,299,299
yogurt,Calan Yogurt Calan Chirimoya 110 grs,299,299
yogurt,Calan Yogurt Calan Frutilla 110 grs,299,299
yogurt,Los Alerces Yogurt Los Alerces Damasco Bolsa kg,1690,1690
yogurt,Surlat Yogurt Batido Surlat Frutilla 110 grs,249,249
yogurt,Surlat Yogurt Batido Surlat Damasco 110 grs,249,249
yogurt,Surlat Yogurt Batido Surlat Vainilla 110 grs,249,249
yogurt,Danone Yogurt Griego Trozo Papaya 110 grs,649,649
jalea,Nestle Jalea Nestle Pina 110 G,399,399
jalea,Soprole Jalea Soprole Frambuesa 110 Gr,399,399
jalea,Soprole Jalea Soprole Piña 110 Gr,399,399
puré,Alcafood Puré Alcafood Tradicional 250 gr,2090,2090
puré,Alcafood Puré Alcafood Tradicional 125 gr,1290,1290
puré,Hoffmann Puré Papas Hoffmann Instantáneo 250 Grs,2290,2290
puré,Alcafood Puré Alcafood Merquén 125 Grs,1490,1490
puré,De la Huerta Puré de Tomates De La Huerta 530 Grs,1000,1190
puré,Alcafood Puré Alcafood Tradicional con pollo para uno 47 gr,1190,1190
puré,Alcafood Puré Alcafood merkén con pollo para uno 47 gr,1190,1190
puré,Twinings Té Twinings Pure Ceylon 10 Bolsas,2000,2000
puré,Fresh Up Toalla Húmeda Pure 99% Agua x 60 Unidades,2190,2190
puré,Airwick Ambiental Airwick Pure Algodón 250 ml,5390,5390
harina,Lucchetti Harina Lucchetti S/P Kilo,1990,1990
harina,Oso Harina Tostada Oso 500 Grs,1290,1290
harina,Collico Harina Collico 3 Kg,3590,3590
harina,Oso Harina Tostada Oso Kilo,2390,2390
harina,Selecta Harina Centeno Selecta 1 Kilo,2590,2590
harina,Selecta Harina Selecta Integral 1 Kg,2690,2690
harina,Kunstmann Harina Tostada Kunstmann 500 Grs,1090,1090
harina,Collico Harina Collico Super 5 Kg,6690,6690
harina,Lucchetti Harina Lucchetti S/P 3Kgs,4990,4990
harina,Selecta Harina Selecta Bake 650 Grs,2790,2790
harina,Selecta Harina Selecta C/P Kilo,1690,1690
harina,Selecta Harina Selecta S/P Kilo,1690,1690
harina,Collico Harina Collico Fuerza 1 Kg,1390,1390
harina,Lucchetti Harina Lucchetti S/P 5 Kilos,8290,8290
harina,Lucchetti Harina Lucchetti C/P Kilo,1890,1890
harina,Selecta Harina Selecta S/P 5 Kilos,7290,7290
harina,Divella Harina Polenta Divella Precocida 500 Grs,2790,2790
harina,Mont Blanc Harina Mont Blanc S/P 5 Kilos,7090,7090
harina,Kunstmann Harina Kunstmann S/P Papel 750 gr,1090,1090
harina,Mariposa Harina Mariposa Sin Polvos Papel 1 Kg,1290,1290
harina,Molino Temuco Harina Molino Temuco Con Polvos de Hornear Kilo,999,999
harina,Collico Harina Collico C/P 1 Kg,1290,1290
harina,Collico Harina Collico Sin Polvos de Hornear 1 Kilo,1190,1190
harina,Mont Blanc Harina Mont Blanc Sin Polvos de Hornear Kilo,1190,1490
harina,Mont Blanc Harina Mont Blanc Con Polvos de Hornear Kilo,1190,1490
harina,Mont Blanc Harina Mont Blanc Sin Polvo de Hornear 3 Kg,3890,3890
harina,Collico Mezcla Collico Tres Leches 400 Gr,3890,3890
harina,Selecta Bizcocho Tortalista Blanco 500 gr,3390,3390
harina,Selecta Queque Tortalista Marmol 380 Grs,3390,3390
harina,Selecta Bizcocho Tortalista Chocolate 500 gr,3390,3390
salchicha,Super Cerdo Salchicha Sureña Super Cerdo Kilo,3990,3990
salchicha,Llanquihue Salchichas Llanquihue 500 Grs,4990,4990
salchicha,Chillán Salchicha Artesanal Chillan 250 Gr,2690,2690
salchicha,PF Salchicha Sureña Pf 250 Gr,1000,1390
salchicha,PF Salchicha Sureñas PF 500 gr,2590,2590
salchicha,Montina Salchicha Tradicional Montina 250 Gr,2290,2290
salchicha,La Preferida Salchicha Sureña La Preferida 500 gr,4190,4190
salchicha,Super Cerdo Salchicha Sureña Super 250 Gr,1290,1290
salchicha,San Jorge Vienesa Pavo San Jorge 250 gr,1290,1290
salchicha,La Española Vienesas La Española 225 gr,1090,1090
salchicha,San Jorge Vienesa Pavo San Jorge 1 Kg,4390,4390
salchicha,San Jorge Vienesa Sureña San Jorge 250 gr,1390,1390
salchicha,San Jorge Vienesa Pollo San Jorge kg,4190,4190
salchicha,San Jorge Vienesa Sureña San Jorge 1 Kg,3590,4190
salchicha,La Preferida Vienesa La Preferida 380 gr,3490,3490
agua,Guallarauco Agua Guallarauco Pera 500 cc,1590,1590
agua,Guallarauco Agua Guallarauco Manzana 500 cc,1590,1590
agua,Benedictino Agua Benedictino Pera botella 2 L,1290,1290
agua,Guallarauco Agua Guallarauco Pera Botella 1 L,1890,1890
agua,Guallarauco Agua Guallarauco Manzana Botella 1 L,1890,1890
agua,Benedictino Agua Benedictino Limonada Jengibre 2 L,1290,1290
agua,Benedictino Agua Benedictino Manzana Botella 2 L,1290,1290
agua,Guallarauco Agua Guallarauco Mango Maracuya Botella 1L,1890,1890
agua,Antartic Chorito Antartic Agua 425 gr,2590,2590
agua,Guallarauco Agua Guallarauco Mango Maracuya 500 cc,1590,1590
agua,Vivo Galleta Vivo Agua 140 Grs,949,949
leche,Leche Sur Leche Condensada Leche Sur Sucedaneo 397 gr,1990,1990
leche,Loncoleche Crema Lonco Leche S/Lactosa 200 ml,1290,1290
leche,Leche Nido Leche Soprole Bolsa 800 Grs,6990,6990
leche,Pitrufquen Leche Entera Pitrufquen Lt,1190,1290
leche,Colun Leche Colun Manjar 1Lt,1790,1790
leche,Soprole Leche Soprole Chocolate 1 L,1690,1690
leche,Loncoleche Leche Lonco Cappuccino Lt,2490,2490
leche,Loncoleche Lonco Leche Chocolate Lt,1890,1890
leche,Colun Leche Colun Frutilla 1 Litro,1790,1790
leche,Loncoleche Lonco Leche Vainilla Lt,1890,1890
leche,Loncoleche Lonco Leche Frutilla Lt,1890,1890
leche,Loncoleche Lonco Leche Platano Lt,1890,1890
leche,Soprole Leche Soprole Entera 1 Litro,1490,1490
leche,Surlat Leche Surlat Chocolate 200 ml,399,399
leche,Loncoleche Margarina C/Leche S/Lact Loncoleche 500 G,3190,3190
leche,Colun Leche Colun Vainilla 1 Lt,1790,1790
leche,Soprole Leche Soprole Frutilla 1 L,1690,1690
leche,Soprole Leche Soprole Frutilla 200 Ml,549,549
leche,Loncoleche Leche Lonco Chocolate 200 ml,599,599
