search,found,price,pre_discount
leche,Loncoleche Leche Vainilla Loncoleche 200 ml,599,599
leche,Colun Leche Entera Colun 200 Cc,549,549
leche,Colun Leche Colun Frutilla 200 Cc,599,599
leche,Colun Leche Colun Manjar 200 Cc,599,599
leche,Colun Leche Colun Chocolate 200 Cc,599,599
leche,Soprole Leche Entera Natural Soprole Lt,1490,1490
leche,Loncoleche Leche Lonco Choco Avellanas Lt,2490,2490
leche,Soprole Leche Soprole Chocolate 200 Ml,549,549
leche,Soprole Leche Soprole Entera 200 Ml,599,599
jugo,Afe Jugo Afe Pera 300 cc,1590,1590
jugo,De la zona Naranja Jugo kilo,1790,1790
jugo,Afe Jugo Afe Membrillo 300 cc,1590,1590
jugo,Traverso Jugo Conc Traverso Mango 900 Cc,1890,1890
jugo,Traverso Jugo Conc Traverso Naranja 900 Cc,1890,1890
jugo,Afe Jugo Afe Ciruela 300 cc,1590,1590
jugo,Traverso Jugo Conc Traverso Piña 900 Cc,1890,1890
jugo,Afe Jugo Afe Manzana Roja 300 cc,1990,1990
papel higiénico,Confort Papel Higiénico Confort Dh 4Rll 50Mts,4190,4190
papel higiénico,Confort Papel Higiénico Confort Dh 8 Rollos 40 Metros,4000,4790
papel higiénico,Elite Papel Higiénico Elite Ultra Dh 24Rll 25Mts,10000,19990
papel higiénico,El Trebol Papel Higiénico Trebol 24 Unidades x 25 mts,6000,8990
papel higiénico,Confort Papel higiénico Confort D/H 30 Mts 4 Und,2090,2090
papel higiénico,Fresh Up Papel Higiénico Húmedo x 25 Con Stiker,999,999
papel higiénico,El Trebol Papel Higiénico El Trébol D/H 25 mt Conveniente 24 Rollos,5490,6990
papel higiénico,El Trebol Papel Higiénico Trebol Ultra Soft Doble Hoja 8 rollos 50 mts,4690,4990
papel higiénico,Confort Papel Higiénico Confort D/H 4 Rollos 27 mts,1690,1890
papel higiénico,Confort Papel Higiénico Confort Familiar 8 Rollos 120 Mts,7000,9290
papel higiénico,Elite Papel Higiénico Elite Ultra Doble Hoja 50 mt X 8 und,6000,8490
papel higiénico,Confort Papel Higiénico Confort Max 100 Mts. X 4 Und.,5190,5190
papel higiénico,Swan Papel Higiénico Swan Hogar Doble Hoja 24 Rollos 25 mts,7490,7490
papel higiénico,Swan Papel Higiénico Swan Mi Hogar Doble Hoja 4 Rollos 50 mts,2390,2390
papel higiénico,Elite Papel Higiénico Elite Ultra Doble Hoja 50 Mts. X 4 Und.,5190,5190
papel higiénico,Confort Papel Higiénico Confort Max Una Hoja 100 mts x 8 Und.,8790,8790
papel higiénico,Confort Higiénico Confort Doble Hoja 40 rollos 22 mts,11000,12790
papel higiénico,Blanco del Sur Higiénico Blanco Del Sur Premium 50 Mtrs 4R,2290,2790
papel higiénico,Fresh Up Toalla Húmeda Adulto x 60 Unid 22x30 cms. Biodegradable y Compostable,3000,3690
jabón,Simonds Mi Primer Jabón Simonds,2990,2990
jabón,Dove Jabón Dove Tripack 90 gr Karite,3890,3890
jabón,Papilion Jabón Líquido Pomegranate 500 ml,1490,1490
jabón,Papilion Jabón Líquido Papilion Vainilla 500 ml,1490,1490
jabón,Protex Jabón Barra Protex Omega 3 125 grs,1090,1090
jabón,Simonds Jabón Simonds Dermo Cremoso Dp 750 cc,1390,2190
jabón,Dove Jabón Dove Barra Blanco 90 Grs,2690,2690
jabón,Simonds Jabón Chocolate Almendras Doypack 750 grs,1390,2190
jabón,Papilion Jabón Líquido Papilion Orchid 500 ml,1490,1490
jabón,Popeye Jabón Popeye Líquido DP 1 L,5290,5290
jabón,Simonds Jabón Simonds Avena Dermo 500 ml,2490,2490
jabón,Giselle Jabón Giselle Surtido Pack 2 300 gr,2690,2690
jabón,Ballerina Jabón Ballerina Yoghurt Arandano Dp 750 ml,1590,1590
jabón,Simonds Jabón Simonds Dermo Avena Dp 750 cc,1390,2190
jabón,Kadus Jabón Líquido Kadus Miel Dp 900 ml,1490,1490
jabón,Dove Jabón Dove Liquido Rec 700ml,4890,4890
jabón,Ballerina Jabón Ballerina Avena D/P 750 ml,1590,1590
jabón,Le Sancy Pack Jabon Le Sancy Verbena Karite 150 gr,3790,3790
jabón,Protex Jabon Protex Antibacterial Limpieza Profunda Barra 3X90Grs,3690,3690
jabón,Le Sancy Jabon Le Sancy Barra Verbena Karite 150Grs,1790,1790
jabón,Dove Jabón Dove Karite Vainilla 90Grs,2690,2690
jabón,Simonds Jabón Afrecho Simonds Hipoalergénico 340 ml,2190,2190
jabón,Gisselle Jabon Gisselle Hidratante DP 750 ml,1790,1790
jabón,Kadus Jabón Liquido Kadus Vainilla Coco 900 ml,1490,1490
jabón,Kadus Jabón Líquido Kadus Manzana Miel 900 ml,1490,1490
jabón,Ballerina Jabón Ballerina Hipoalergénico D/P 750 ml,1590,1590
jabón,Protex Jabón Barra Protex Aloe 125 Grs,1090,1090
jabón,Giselle Jabón Giselle Surtido Pack 3 270 gr,1890,1890
jabón,Simonds Jabón Líquido Dermo Jalea Real Litro,2890,2890
jabón,Papilion Jabón Líquido Papilion Blackberry 500 ml,1490,1490
jabón,Ballerina Jabón Ballerina Yoghurt y Berries Vainilla Dp 750 ml,1590,1590
lavalozas,Wyn Lavalozas Wyn 750 ml,1790,1790
lavalozas,Impeke Lavaloza Impeke Limón 750 ml,1490,1490
lavalozas,El Trebol Lavalozas Trébol 1.5 Litros,2690,2990
lavalozas,El Trebol Lavalozas 750 ml Trebol,1290,1590
lavalozas,Popeye Lavaloza Popeye Hipoalergénico DP 1 L,2190,2190
lavalozas,Quix Lavaloza Quix Concentrado 1500 ml,3000,3990
lavalozas,El Trebol Lavaloza Concentrado Trebol 1.5 Litros,2290,2990
lavalozas,Virutex Lavaloza Virutex Biodegradable 500 cc,949,1690
lavalozas,Virginia Lavalozas Virginia Limón Citrus 750 ml,1790,1790
lavalozas,Virutex Lavaloza Higienizante Virutex 500 ml,949,1690
lavalozas,El Trebol Lavalozas El Trebol Naranja 750 ml,1190,1990
lavalozas,El Trebol Lavalozas Concentrado Doypack 1 Litro Trebol,1790,2490
lavalozas,Quix Lavalozas Quix Poder Limón 750 ml,2000,2290
lavalozas,Quix Lavaloza Quix Ultra Doypack 450 ml,1590,2190
lavalozas,Virginia Lavalozas Virginia Ultra Concentardo Limon 500 ml,1590,1890
lavalozas,El Trebol Lavalozas El Trébol Limón 500 ml,999,1490
lavalozas,Virutex Lavaloza Piel Sensible Virutex 500 ml,949,1690
lavalozas,Fuzol Lavalozas Concentrado Vinagre Fuzol Doy Pack 1000 ml,1390,1590
lavalozas,Fuzol Lavalozas Fuzol Limón Doy Pack 1 Litro,1390,1590
lavalozas,El Trebol Lavalozas El Trébol Limón 500 ml,1390,1390
lavalozas,El Trebol Pack 2 Detergentes 3 kg + Lavalozas 750 ml Trébol,10000,12090
lavalozas,Virginia Lavaloza Virginia D/P Limón Citrus Litro,1390,1590
lavalozas,Quix Quix Limón Bio Activos Concentrado 500 ml,1490,1490
esponja,Virutex Esponja Lisa - Clásica,549,549
esponja,Spunita Esponja Spunita - Clásica,1790,1790
esponja,Virutex Esponja Acero - Clásica,499,499
esponja,Virutex Esponja Orotex Mediana - Clásica,1690,1690
esponja,Virutex Esponja Virutex Orotex X3 Mediana,3190,3190
esponja,Virutex Esponja Acanalada X3 virutex,1890,1890
esponja,El Trebol Esponja Acanalada Trébol 3 Unidades,1190,1190
esponja,Virutex Esponja Acanalada Cobre X2 Creativa,1890,1890
esponja,El Trebol Esponja Lisa Trébol 10 Unidades,2000,2190
esponja,Vileda Esponja Vileda Pur Active 2 unidades,2390,2390
esponja,Virutex Esponja Inox Con Mangoplatinum - Clasica,1890,1890
esponja,Virutex Esponja Lisa X 4 - Clásica,1690,1690
esponja,Virutex Esponja Acanalada 3+1 - Clásica,1690,1990
esponja,Virutex Esponja Lisa Cobre X 2 Creativa,1790,1790
esponja,Vileda Esponja Vileda Antiresiduo Inox Und,1590,1590
esponja,Vileda Esponja Vileda Antiresiduo Inoxidable X2,4290,4290
esponja,Virutex Esponja Inox Platinum Virutex Clasica 3Und,2890,2890
esponja,El Trebol El Trebol Esponja Teflon X 1,199,199
esponja,Vileda Esponja Vileda Fresh Lisa 2 unidades,2090,2090
esponja,El Trebol Esponja Teflon X 3 El Trebol,399,399
esponja,Virutex Paño Celulosa esponja Virutex 6 und,4590,4590
esponja,Virutex Lana Grande - Clásica,799,799
esponja,Virutex Mago Pads S/Jabon X6 Bolsa - Clásica,1290,1290
esponja,El Trebol El Trebol Pads Con Jabón 4 unid Caja,549,549
esponja,Virutex Mago Pads C/Jabon X4 Bolsa - Clásica,1390,1390
esponja,Virutex Virutilla Extra Gruesa Mediana #6 - Clásica und,1390,1390
esponja,Virutex Mago Pads C/Jabon X6 Estuche - Clásica,1690,1690
esponja,El Trebol El Trébol Lana De Acero X 1,149,149
esponja,El Trebol Virutilla Grande Numero El Trebol 2 Fina,499,499
esponja,Virutex Mago Pads Sin Jabón Virutex Bolsa 12 und,1990,1990
virutilla,Virutex Virutilla Extra Gruesa Mediana #6 - Clásica und,1390,1390
virutilla,El Trebol Virutilla Grande Numero El Trebol 2 Fina,499,499
virutilla,Virginia Virutilla Líquida Virginia Piso Madera 900 ml,3890,3890
virutilla,Vileda Esponja Vileda Antiresiduo Inox Und,1590,1590
virutilla,Vileda Esponja Vileda Antiresiduo Inoxidable X2,4290,4290
virutilla,Vileda Esponja Vileda Fresh Lisa 2 unidades,2090,2090
virutilla,Virutex Lana Grande - Clásica,799,799
virutilla,Virutex Esponja Acanalada X3 virutex,1890,1890
virutilla,El Trebol El Trebol Esponja Teflon X 1,199,199
virutilla,Virutex Esponja Inox Con Mangoplatinum - Clasica,1890,1890
virutilla,Virutex Esponja Lisa X 4 - Clásica,1690,1690
virutilla,Virutex Esponja Acanalada 3+1 - Clásica,1690,1990
virutilla,El Trebol Esponja Acanalada Trébol 3 Unidades,1190,1190
virutilla,Virutex Esponja Lisa Cobre X 2 Creativa,1790,1790
virutilla,Virutex Esponja Orotex Mediana - Clásica,1690,1690
virutilla,Virutex Esponja Acanalada Cobre X2 Creativa,1890,1890
virutilla,Virutex Mago Pads S/Jabon X6 Bolsa - Clásica,1290,1290
virutilla,El Trebol El Trebol Pads Con Jabón 4 unid Caja,549,549
virutilla,Spunita Esponja Spunita - Clásica,1790,1790
virutilla,Virutex Esponja Acero - Clásica,499,499
virutilla,Virutex Esponja Inox Platinum Virutex Clasica 3Und,2890,2890
virutilla,El Trebol Esponja Lisa Trébol 10 Unidades,2000,2190
virutilla,Virutex Mago Pads C/Jabon X4 Bolsa - Clásica,1390,1390
virutilla,Virutex Mago Pads C/Jabon X6 Estuche - Clásica,1690,1690
virutilla,Vileda Esponja Vileda Pur Active 2 unidades,2390,2390
virutilla,El Trebol El Trébol Lana De Acero X 1,149,149
virutilla,Virutex Esponja Virutex Orotex X3 Mediana,3190,3190
virutilla,Virutex Esponja Lisa - Clásica,549,549
virutilla,Virutex Mago Pads Sin Jabón Virutex Bolsa 12 und,1990,1990
shampoo,Head & Shoulders Shampoo Head Shoulders Antifall 375 ml,3790,4590
shampoo,Babyland Shampoo Brillitos Babyland 410 ml,2390,2390
shampoo,Sedal Shampoo Sedal Rizos Definidos 340 ml,2790,2790
shampoo,Sedal Shampoo Sedal Prebióticos Biotina 340 ml,2790,2790
acondicionador,Ballerina Acondicionador Ballerina Carbón 750 ml,1690,1690
acondicionador,Babyland Acondicionador Brillitos Babyland 410 ml,2390,2390
acondicionador,Ilicit Acondicionador Ilicit Kerav Matizador 350 ml,4990,4990
acondicionador,Familand Acondicionador Familand Doypack Moringa 750 ml,1190,1390
acondicionador,Sedal Acondicionador Sedal Restauración Instantánea 340 ml,2790,2790
acondicionador,Sedal Acondicionador Sedal Rizos Definidos 340 ml,2790,2790
cloro,Cif Cif Cloro Gel Cloro Tradicional 800 ml,2490,2490
cloro,Impeke Cloro Concentrado Tradicional Impeke 2 kilos,2090,2090
cloro,Impeke Cloro Concentrado Tradicional Impeke Kilo,1290,1290
cloro,Clorox Cloro Ropa Color Impeke 2Kl,3390,3390
cloro,Impeke Cloro Concentrado Forte Impeke Kilo,1290,1290
cloro,Clorox Cloro Gel Original Clorox 900 Ml,2990,2990
cloro,Impeke Cloro Ropa Blanca Impeke kg,1490,1490
cloro,Impeke Cloro Gel Impeke Citrus 900 Ml,1000,1390
cloro,Clorox Cloro Gel Lavanda Clorox  900 Ml,2990,2990
cloro,Clorox Cloro Gel Menta Clorox 900 ml,2990,2990
cloro,Impeke Cloro Ropa Color Impeke 930 gr,2090,2090
cloro,Cif Cloro Gel Cif Lavanda 800 ml,2490,2490
cloro,El Trebol El Trebol Cloro Concentrado X 2 Lts 5%,1990,1990
cloro,Cif Cif Cloro Gel Limón 800 ml,2490,2490
cloro,Impeke Cloro Gel Impeke Tradicional 900 ml,1000,1890
cloro,Clorox Cloro Gel Lavanda Clorox  1.5 Lt,4490,4490
cloro,El Trebol Cloro Gel Tradicional El Trebol 900 ml,1000,1590
cloro,Doña Gaby Limpiador Crema Cloro Doña Gaby 750 ml,1690,1690
cloro,Impeke Cloro Gel Impeke Aroma Limón 900 ml,1000,1890
cloro,El Trebol Cloro Concentrado El Trebol 1 L 5%,1000,1290
cloro,Clorox Clorox Desinf Antihongos Gat 500 Ml,5390,5390
cloro,Clorinda Clorinda Lavanda   1.9 Lt,3390,3390
cloro,Clorinda Clorinda Ropa Color 1800Grs,5190,5190
cloro,Clorox Clorox Ropa Blanca Intensos 1900Cc,3990,3990
cloro,Clorox Clorox Ropa Blanca Intensos 960 Grs,2390,2390
cloro,Clorox Clorox Tradicional 2Kls,3590,3590
cloro,Clorox Clorox Aroma Lavanda 1900Cc,3490,3490
cloro,Clorinda Clorinda Ropa Color 930 Grs,3090,3090
cloro,Clorox Clorox Gel 1.5 Lt Menta Fresca,4490,4490
cloro,Clorinda Clorinda Aroma Limon 950 G,1990,1990
cloro,Clorox Clorox Tradicional 1Kg,1990,1990
cloro,Clorox Clorox  Ropa Colores Vivos 960 gr,4090,4090
cloro,Clorox Clorox Ropa Colores Vivos 1800Grs,7990,7990
cloro,Clorox Clorox Aroma Lavanda 950 Cc,2090,2090
cloro,Clorox Clorox Frescura Limon 950Cc,2090,2090
cloro,Clorinda Clorinda Litro,1890,1890
cloro,Clorinda Clorinda Aroma Lavanda 950 G,1990,1990
cloro,Clorinda Clorinda Gel Regular 1.5 Litros,3990,3990
cloro,Clorinda Clorinda Gel Menta 900 Grs,1990,1990
cloro,Clorinda Clorinda Gel 900 Grs,1990,1990
cloro,Clorinda Clorinda Gel Flores Silvestres 900,1990,1990
toalla papel,Nova Toalla Papel Nova Ultra Mega 26 mts,1690,1690
toalla papel,Mi hogar Toalla Papel Mi Hogar D/H 3 Rll,1190,1390
servilleta,Elite Servilleta Elite Mesa 200 unidades,3890,3890
servilleta,Elite Servilleta Elite Cóctel Una Hoja 200 Unidades,1590,1790
servilleta,Elite Servilleta Cocktail Elite Blanca 50 Uds,499,499
servilleta,Nova Servilleta Nova Clasica Coctel X 50 Und.,349,349
servilleta,Elite Servilleta Elite Mesa Blanca X 50 Und.,799,799
detergente,Omo Detergente Omo Polvo Bicarbonato 800 Grs,2790,2790
detergente,Ariel Detergente Ariel Polvo 700 grs,1890,2590
detergente,El Trebol Detergente Trebol Plus 3 Litros Lavanda,4490,5990
detergente,Biofrescura Detergente Biofrescura Polvo Campos De Hielo 2.5Kilos,4000,5990
detergente,El Trebol Detergente Trebol 5 Kg Aroma Lavanda,7000,8990
detergente,Drive Detergente Drive Liquido Doypack 3 litros,9000,9990
detergente,Biofrescura Detergente Biofrescura Polvo Desierto Florido 2.5Kilos,4000,5990
detergente,El Trebol Detergente Trebol Plus 3 Litros Encantos del Sur,4490,5990
detergente,El Trebol Detergente Trebol 5 Kg Aroma Tradicional,7000,8990
detergente,"Omo Detergente Polvo Omo Bicarbonato 2,7 Kg",6000,9990
detergente,Biofrescura Detergente Biofrescura Polvo Bosque Nativo 2.5Kilos,4000,5990
detergente,Fuzol Detergente Líquido Fuzol Hipo Dp 3 lts,5990,5990
detergente,Ace Detergente Ace Líquido 2800 ml,9990,9990
detergente,Ace Detergente Ace Naturals Polvo Manzanilla 800 gr,2290,2290
detergente,El Trebol Detergente Líquido El Trebol Tradicional 3 L,3990,4590
detergente,El Trebol Detergente Trebol Tradicional Plus 3 Litros Tradicional,4490,5990
detergente,Popeye Detergente Popeye Hipo Dp 800 ml,3790,3790
detergente,Rinso Detergente Líquido Rinso 3 Lts Lirios y Rosas,5990,5990
detergente,Finish Finish Detergente Polvo Lava vajillas kilo,7690,7690
