Producto Encontrado,Precio
Gelatina Caricia Sabor Piña 50 g ,860
Gelatina Caricia Sabor Frutilla 50 g ,860
Gelatina Vivo Sin Azúcar Durazno 22 g ,690
Gelatina Stevia Berries 22 g ,607
Gelatina Sin Sabor Caja En Polvo 30 g ,1369
Gelatina Caricia Sabor Naranja 50 g ,860
Gelatina Stevia Limón 22 g ,607
Flan Vivo Sin Azúcar Chocolate Con Caramelo 90 g ,890
Semola Vivo Sin Azúcar Con Caramelo Vivo 150 g ,890
Flan Ambrosoli Vainilla 90 g ,1279
Gelatina Livean Sin Azúcar Piña ,855
Gelatina Ambrosoli Piña 100 g ,949
Gelatina Stevia Piña 22 g ,607
Gelatina Stevia Naranja 22 g ,607
Flan Ambrosoli Chocolate 90 g ,1279
Flan Livean Berries 20 g ,945
Gelatina Livean Sin Azúcar Naranja 20 g ,855
Sémola Ambrosoli Con Caramelo 150 g ,1279
Flan Livean Chocolate 20 g ,945
Postre Crema Ambrosoli Chocolate Nuss 100 g ,1229
Gelatina Sin Sabor Gourmet Sachet 12 g Colapez 5 Hojas ,1670
Postre Suny Ambrosoli 100 g ,1199
Compota Mother's Maid Manzana y Canela 113 g 6 un. ,4590
Puré de Papas Hoffmann 250 g ,2030
Puré de Papas Maggi 187 g ,2530
Puré de Papas Instantáneo 250 g ,1990
Puré de Papas Instantáneo Alcafood Tradicional 1 kg ,6620
Puré de Papas Instantáneo 800 g ,6540
Puré de Papas Maggi 751 g ,7870
Puré de Papas Hoffmann 1 kg ,7770
Puré de Papas Instantáneo Alcafood Tradicional 250 g ,2130
Puré de Papas Maggi 93 g ,1630
Harina Mont Blanc Sin Polvos de Hornear 1 kg ,1000
Harina Máxima Sin Polvos de Hornear 1 kg ,890
Harina Selecta Sin Polvos de Hornear 1 kg ,1670
Harina Flor Collico Sin Polvos de Hornear 1 kg ,1470
Harina Sin Polvo de Hornear 1 kg ,1000
Harina Sin Polvos de Hornear 10 kg ,12390
Harina Selecta Sin Polvos de Hornear 3 kg ,4290
Harina Mont Blanc Sin Polvos de Hornear 5 kg ,6630
Harina Selecta Sin Polvos de Hornear 10 kg ,11990
Harina Sin Polvos de Hornear 3 kg ,4190
Harina Sin Polvos de Hornear 5 kg ,6890
Salchicha de Ave Montina 20 un. 1 kg ,4650
Salchichas Receta del Abuelo Premium 500 g 10 un. ,3390
Salchichas San Jorge 1 kg 20 un. ,3490
Salchicha Sureña PF 1 kg ,4290
Longaniza Ahumada Cecinas Chillán Tradicional kg ,2850
Salchichas San Jorge 250 g ,1250
Chorizo Parrillero PF 1 kg ,5090
Salchicha Sureñas PF 250 g 5 un. ,1350
Salchicha Sureña San Jorge 1 kg 20 un. ,3690
Salchicha Winter Tradicional 1 kg ,3590
Salchicha Pollo Montina Sureña 1 kg ,5090
Salchicha Llanquihue Tradicional 5 un. ,3550
Salchicha Pavo PF 250 g 5 un. ,1290
Longaniza Schwencke Granel ,2850
Salchicha Llanquihue Tradicional 10 un. ,6490
Salchichas Receta del Abuelo Premium 250 g 5 un. ,2350
Chorizo Parrillero Receta del Abuelo 400 g ,4290
Chorizo Angus La Preferida 500 g 8 un. ,5240
Salchichas Pollo Winter 1 kg ,3830
Salchichas Receta del Abuelo Premium 750 g 15 un. ,5990
Salchichas 1 kg ,3890
Salchicha Sureña Receta del Abuelo 500 g 10 un. ,3390
Longaniza Schwencke 500 g ,6190
Salchicha Pavo PF 1 kg ,4290
Salchicha Sureña San Jorge 250 g ,1390
Salchicha Tradicional PF 1 kg ,4290
Chorizo de Campo Receta del Abuelo 400 g ,4290
Longanicilla de Campo Receta del Abuelo 280 g ,3150
Longaniza Parrillera PF 1 kg ,4850
Chorizo Parrillero Schwencke 500 g ,6190
Prieta Receta del Abuelo 350 g ,2690
Chorizo Parrillero PF Selección 400 g ,2550
Salchicha Llanquihue Tradicional 20 un. ,12290
Chorizos San Jorge 800 g ,3790
Salchichas Sureñas La Preferida 10 un. 500 g ,4250
Vienesas La Preferida Sin Piel 380 g 7 un. ,3590
Longaniza Angus La Preferida 500 g ,5090
Snack Mini Chorizo Receta del Abuelo 60 g ,1450
Longaniza Llanquihue 250 g ,3490
Agua Mineral Benedictino Sin Gas 3 L ,1430
Agua Mineral Vital Sin Gas 1.6 L ,1040
Agua Mineral Cachantun Sin Gas 1.6 L ,1090
Agua Mineral Cachantun Sin Gas 6 L ,2190
Agua Mineral Vital Sin Gas 990 ml ,1140
Agua Mineral Vital Sin Gas 600 ml ,840
Agua Mineral Cachantun Sin Gas 1 L ,1380
Leche Semidescremada Nido 3+ Protec 1.35 kg ,16990
Leche Polvo Nido Entera 1.1 kg ,10390
Leche Soprole Entera Natural 1 L ,1249
Leche en Polvo Nido Buen Día Semidescremada 700 g ,6099
Leche Soprole Semidescremada Natural 1 L ,1249
Leche Cuisine & Co Entera 1 L ,1000
Leche Surlat Descremada Sin Lactosa 1 L ,1369
Leche Cuisine & Co Semidescremada 1 L ,1000
Leche Surlat Entera 1 L ,1040
Leche en Polvo Nido Entera 1350 g ,14790
Leche Colun Entera 1 L ,1319
Leche Cuisine & Co Descremada 1 L ,1000
Leche Surlat Semidescremada Sin Lactosa 1 L ,1369
Leche Polvo Colun Entera 900 g ,6490
Leche Colun Semidescremada Chocolate Receta Original 1 L ,1759
Leche Soprole Descremada Natural 1 L ,1249
Leche Surlat Semidescremada 1 L ,1040
Leche Loncoleche Semidescremada Sin Lactosa 1 L ,1429
Leche Soprole Semidescremada Chocolate 200 ml ,559
Leche Soprole Semidescremada Chocolate 1 L ,1300
Leche Colun Semidescremada 1 L ,1319
Leche Soprole Sin Lactosa Entera 1 L ,1189
Leche Loncoleche Descremada Sin Lactosa 1 L ,1429
Leche Surlat Descremada 1 L ,1040
Leche Surlat Entera Sin Lactosa 1 L ,1369
Leche Loncoleche Entera Sin Lactosa 1 L ,1429
Leche Soprole Semidescremada Frutilla 200 ml ,559
Leche Colun Descremada Sin Lactosa 1 L ,1319
Leche Colun Descremada 1 L ,1319
Leche Soprole Semidescremada Chocolate Requetepatitas 200 ml ,559
Leche Colun Entera Sin Lactosa 1 L ,1319
Leche Colun Semidescremada Chocolate 200 cc ,585
Leche Colun Semidescremada Sin Lactosa 1 L ,1319
Leche Soprole Proteína Natural 1 L ,2439
Leche Soprole Sin Lactosa Chocolate 1 L ,1849
Leche Soprole Sin Lactosa Chocolate 200 ml ,549
Leche Semidescremada Soprole con Avena 1 L ,1300
Leche Soprole Semidescremada Frutilla 1 L ,1300
Leche Loncoleche Cappucino Proteína 1 L ,2489
Leche en Polvo Svelty Move+ Descremada 800 g ,7170
Jugo en Polvo Livean Piña 7 g ,285
Jugo en Polvo Livean Frutilla 7 g ,285
Jugo en Polvo Livean Naranja 7 g ,285
Jugo En Polvo Vivo Naranja-Frutilla 7 g ,280
Jugo en Polvo Livean Melón Tuna 7 g ,285
Jugo en Polvo Livean Mango 7 g ,285
Jugo en Polvo Livean Limonada 7 g ,285
Jugo en Polvo Livean Papaya 7 g ,285
Jugo en Polvo Livean Berries 7 g ,285
Jugo en Polvo Livean Pera Agua 7 g ,285
Jugo en Polvo Livean Durazno 7 g ,285
Jugo En Polvo Vivo Melón Tuna 7 g ,280
Jugo en Polvo Livean Maracuyá 7 g ,285
Jugo en Polvo Livean Manzana Verde 7 g ,285
Jugo En Polvo Vivo Durazno Huesillo 8 g ,280
Jugo en Polvo Livean Huesillo 7 g ,285
Jugo Polvo Zuko Naranja 15 g ,265
Jugo Polvo Zuko Piña 15 g ,265
Jugo Polvo Sprim Frambuesa 20 g ,315
Jugo Polvo Zuko Frambuesa 15 g ,265
Jugo en Polvo Sprim Durazno 20 g ,315
Jugo Polvo Sprim Piña 25 g ,315
Jugo Polvo Zuko Durazno 15 g ,265
Jugo Polvo Vivo Granada Con Sucralosa 7 g ,280
Jugo Polvo Zuko Naranja Plátano 15 g ,265
Jugo en Polvo Sprim Melón Tuna 20 g ,315
Jugo Polvo Zuko Melón 15 g ,265
Jugo Polvo Zuko Limonada Frambuesa 15 g ,265
Jugo Polvo Zuko Frutilla 15 g ,265
Jugo en Polvo Sprim Mango 20 g ,315
Jugo en Polvo Livean Té Verde Limón 7 g ,285
Jugo Polvo Zuko Manzana 15 g ,265
Jugo Polvo Sprim Frutilla 20 g ,315
Jugo Polvo Zuko Huesillo 15 g ,265
Jugo Polvo Zuko Limón Dulce 15 g ,265
Jugo Polvo Zuko Mango 15 g ,265
Jugo Polvo Zuko Limonada 15 g ,265
Jugo en Polvo Livean Bienestar 7 g ,335
Jugo Polvo Zuko Lulada 15 g ,265
Jugo en Polvo Livean Manzana Con Fibra 10 g ,335
Papel Higiénico Confort Doble Hoja 50 m 4 un. ,3690
Papel Higiénico Confort Doble Hoja 22 m 4 un. ,1570
Papel Higiénico Noble Doble Hoja 22 m 40 un. ,10390
Papel Higiénico Confort Doble Hoja 40 m 8 un. ,5950
Papel Higiénico Confort Doble Hoja 22 m 40 un. ,13190
Papel Higiénico Favorita Lavanda 22 m 40 un. ,10190
Papel Higiénico Elite Doble Hoja Ultra 50 m 8 un. ,8490
Papel Higiénico Confort Familiar Una Hoja 120 m 8 un. ,11390
Papel Higiénico Confort Max Una Hoja 100 m 8 un. ,9790
Papel Higiénico Noble Doble Hoja 22 m 6 un. ,1690
Papel Higiénico Family Care Doble Hoja 25 m 40 un. ,12790
Papel Higiénico Noble Doble Hoja 23 m 4 un. ,1550
Papel Higiénico Scott Rindemax Doble Hoja 22 m 4 un. ,1000
Papel Higiénico Family Care Doble Hoja 25 m 24 un. ,7990
Papel Higiénico Confort Doble Hoja 25 m 24 un. ,10190
Papel Higiénico Elite Ultra Suave Doble Hoja 25 m 12 un. ,6450
Papel Higiénico Family Care Doble Hoja 50 m 4 un. ,4190
Papel Higiénico Confort Una Hoja 50 m 8 un. ,5590
Papel Higiénico Elite Eco Doble Hoja 50 m 9 un. ,9990
Papel Higiénico Elite Doble Hoja Ultra 50 m 18 un. ,15690
Papel Higiénico Family Care Hoja Simple 50 m 8 un. ,3390
Papel Higiénico Scott Rindemax Doble Hoja 22 m 24 un. ,6990
Papel Higiénico Swan Doblemente Blanco 22 m 6 un. ,2050
Papel Higiénico Confort Doble Hoja 25 m 6 un. ,2990
Papel Higiénico Swan Mi Hogar 50 m 4 un. ,2690
Papel Higiénico Family Care Triple Hoja 22 m 12 un. ,4990
Papel Higiénico Elite Doble Hoja Ultra 50 m 4 un. ,4390
Papel Higiénico Confort Doble Hoja 25 m 8 un. ,3990
Papel Higiénico Family Care Doble Hoja 50 m 18 un. ,12790
Papel Higiénico Elite Soft & Strong Triple Hoja 40 m 4 un. ,4790
Papel Higiénico Family Care Doble Hoja 50 m 8 un. ,5990
Papel Higiénico Scott Protect Care Doble Hoja 26 m 8 un. ,3490
Papel Higiénico Scott Protect Care Doble Hoja 22 m 16 un. ,6890
Papel Higiénico Elite Ultra Doble Hoja 25 m 4 un. ,2490
Papel Higiénico Favorita Acolchado Doble Hoja 22 m 4 un. ,1403
Papel Higiénico Favorita Soft Care Doble Hoja 50 m 4 un. ,3512
Papel Higiénico Elite Soft & Strong Triple Hoja 40 m 12 un. ,12790
Papel Higiénico Favorita Sensación Doble Hoja 22 m 6 un. ,2290
Papel Higiénico Favorita Soft Care Doble Hoja 40 m 8 un. ,8190
Papel Higiénico Scott Rindemax Doble Hoja 21.78 m 6 un. ,2490
Jabón Líquido Dove Original 700 ml ,3220
Jabón Líquido Ballerina Avena y Almendras 750 ml ,1750
Jabón Líquido Ballerina Avena Almendra 1.3 L ,1990
Jabón Líquido Ballerina Hipoalergénico 750 ml ,1750
Jabón Líquido Ballerina Crema Piel Sensible 750 ml ,1990
Jabón Líquido Simond's Dermo Care Hygienic 1.5 L ,3290
Jabón Líquido Ballerina Yoghurt y Arándanos 750 ml ,1750
Jabón Líquido Ballerina Coco Jazmín 1.3 L ,1990
Jabón Líquido Dove Karité 700 ml ,3220
Jabón Líquido Kadus Vainilla Coco 900 ml ,1450
Jabón Líquido Kadus Manzana Miel 900 ml ,1450
Jabón Líquido Le Sancy Aceite de Almendras 750 ml ,2750
Jabón Líquido Baby Lee Doypack 750 ml ,1850
Jabón Líquido Babyland Glicerina Doypack 750 ml ,1550
Jabón Líquido Ballerina Crema Karité 750 ml ,1990
Jabón Líquido Arom Cremoso Doypack 750 ml ,1690
Jabón Líquido Le Sancy Antibacterial 750 ml ,2350
Jabón Líquido Le Sancy Almendra 450 ml ,1180
Jabón Líquido Dove Mandarina 700 ml ,3220
Jabón Líquido Simond's Dermo Care Avena Doypack 750 ml ,1990
Jabón Líquido Arom Frutos Del Sur Doypack 750 ml ,1590
Jabón Líquido Bellekiss Cremoso Doypack 1.5 L ,2650
Jabón Líquido Ballerina Coco Jazmín 750 ml ,1750
Jabón Líquido Simond's Hygienic Hipoalergénico 1 L ,2850
Jabón Líquido Arom Avena & Almendras Doypack 750 ml ,1590
Jabón Líquido Kadus Almendra 900 ml ,1450
Jabón Líquido Dove 450 ml ,1890
Jabón Líquido Simond's Dermo Care Cremoso Ph Neutro 1 L ,2850
Jabón Líquido Simond's Dermo Care Avena 1 L ,2850
Jabón Líquido Simond's Castaña 500 ml ,2290
Jabón Líquido Simond's Dermo Care Hygienic 750 ml ,1990
Jabón Líquido Le Sancy Hygienic Doypack 450 ml ,1180
Jabón Líquido Arom Paraíso Floral Doypack 750 ml ,1590
Jabón Líquido Simond's Dermocream Syndet Urea 400 ml ,3350
Jabón Líquido Familand Avena Karité 500 ml ,2290
Jabón Líquido Simond's Blanco 750 ml ,2550
Pack Jabón Líquido Dove Original 700 ml + 1 un. 250 ml ,5490
Jabón Líquido Le Sancy Manzanilla y Miel Doypack 450 ml ,1180
Jabón Líquido Simond's Dermo Care Cremoso Doypack 750 ml ,1990
Jabón Líquido Simond's Celeste 750 ml ,2550
Lavaloza Quix Ultra Concentrado 200 ml ,1000
Lavalozas Quix Bio-Activos Concentrado Recarga 1.5 L ,3590
Lavalozas Fuzol Limón Doypack 1 L ,1950
Lavalozas Quix Bio-Activos Concentrado Limón 500 ml ,2050
Lavaloza Quix Limón Doypack 480 ml ,990
Lavalozas Quix Ultra Concentrado 450 ml ,2490
Lavalozas Quix Ultra Concentrado 500 ml ,2390
Lavalozas Fuzol Vinagre Doypack 1 L ,1950
Lavaloza Quix Limón Concentrado 900 ml ,2390
Lavalozas Virginia Limón Citrus Doypack 1 L ,2250
Lavalozas Máxima Limón 2 L ,1450
Lavaloza Quix Bio-Activos Aloe Vera Recarga 1.2 L ,4490
Lavalozas Concentrado Wyn 750 ml ,1780
Lavalozas Home Care Activos BIO Concentrado Limón Doypack 1 L ,2450
Lavaloza Antibacterial Quix Concentrado 1.2 L ,4490
Lavaloza Quix Bio-Activos Pureza Esencial Recarga 1.2 L ,4490
Lavalozas Home Care Activos BIO Concentrado Limón 750 ml ,1790
Lavalozas Excell con Cloro Doypack 1 L ,2050
Lavaloza Virginia Citrus Botella Recarga 1.5 L ,3390
Lavalozas Home Care Activos BIO Concentrado Limón 500 ml ,1750
Lavalozas Quix Bio-Activos Concentrado Aloe Vera 500 ml ,2350
Lavalozas Quix Ultra Concentrado 300 ml ,2650
Lavalozas Quix Bio-Activos Concentrado Limón 750 ml ,2950
Lavalozas Virginia Ultra Concentrado 200 ml ,1000
Lavaloza Quix Ultra Concentrado 500 ml ,2990
Lavalozas Virginia Ultra Concentrado Doypack 450 ml ,2390
Lavalozas Quix Bio-Activos Concentrado Pureza 500 ml ,2350
Lavalozas Virginia Concentrado Citrus 450 ml ,1450
Lavalozas Fuzol Bio 750 ml ,2150
Lavalozas Virginia Concentrado Limón 750 ml ,2390
Lavalozas Virginia Concentrado Citrus 500 ml ,3090
Lavalozas Máxima Limón 5 L ,3250
Lavalozas Máxima Vinagre 2 L ,1450
Lavaloza Virginia Citrus 500 ml ,1000
Lavalozas Fuzol Limón Doypack 750 ml ,1390
Lavalozas Home Care Activos Bio Concentrado Recargable 1.5 L ,3184
Lavaloza Magistral Limón Botella 300 ml ,2990
Lavaloza Wyn Ultra 500 ml ,2690
Lavaloza Magistral Limón Botella 500 ml ,4390
Lavaloza Magistral Limón Botella 750 ml ,5990
Esponja Virutex Antibacterial Lisa 4 un. ,1160
Esponja Lisa Manlac 4 un. ,792
Esponja Lisa x 4 Home Care ,1290
Esponja Fibro Lisa 4 un. ,1250
Esponja Dorada 3 un. ,1950
Esponja Virutex Dorada Orotex Mediana 3 un. ,2690
Esponja Fibro Activ Acanalada 3 un. ,1550
Esponja Plástica No Raya Home Care ,1590
Esponja Virutex Acero Inoxidable con Mango ,2150
Esponja Metálica Manlac Plata 3 un. ,1850
Esponja Anatómica Home Care 3 un. ,1450
Esponja Virutex Acanalada Antibacterial Cobre 2 un. ,1990
Esponja Virutex Dorada Mediana 1 un. ,1650
Esponja Virutex Acanalada Antibacterial 4 un. ,2190
Esponja Virutex Plástica Spunita 1 un. ,1850
Esponja Atrapa Polvo Damp Duster 1 un. ,2150
Esponja Acero Clásica Virutex ,590
Esponja Virutex Acanalada Antibacterial 3 un. ,1550
Esponja Doble Scrub Mommy Essentials ,2950
Esponja Scrub Daddy ,3950
Esponja Pur Active Vileda 2 un. ,1950
Esponja Acero Inoxidable Scour Daddy 2 un. ,5890
Esponja Antibacterial Home Care Dorada 3 un. ,2150
Esponja Calzado Virginia Autobrillo Incolora ,2490
Esponja Acanalada Limpieza Pesada 3 un. ,2550
Esponja Jabonosa  Seca Care Up Vida Activa 10 un. ,3490
Paño Esponja Home Care Absorbente 18 x 18 cm 3 un. ,2890
Paño Esponja Virutex Spongi Absorbente 3 un. ,3550
Paños Esponja Vileda 3 un. ,3150
Paño Esponja Fibro 3 un. ,2950
Paños Virutex Esponja Natural 6 un. ,4290
Paño Esponja Fibro 19 x 20 cm 6 un. ,4490
Shampoo 3 en 1 Gelatti Bob Esponja 300 ml ,2850
Virutilla Manlac N°4 Grande ,1690
Virutilla Líquido Virginia 900 ml ,3750
Virutilla Virutex Lana N°4 ,840
Shampoo Sedal Luminous UV 340 ml ,2163
Shampoo Dove Bond Intense Repair 400 ml ,3890
Shampoo Sedal 340 ml + Acondicionador Bomba Variedades 340 ml ,4590
Shampoo Ballerina Reparación 750 ml ,1590
Shampoo Herbal Essences Smooth Rose Hips 865 ml ,9490
Shampoo Ballerina Manzanilla 750 ml ,1590
Shampoo Head & Shoulders Limpieza Renovadora 1 L ,10190
Shampoo Elvive Glycolic Gloss 370 ml ,3912
Shampoo Head & Shoulders Limpieza Renovadora 375 ml ,4990
Shampoo Elvive Hialurónico Pure 370 ml ,3912
Shampoo Pantene Pro-V Bambú Nutre & Crece 400 ml ,4890
Shampoo Head & Shoulders Limpieza y Revitalización Argán 1 L ,10190
Shampoo Sedal Prebióticos + Biotina 340 ml ,2390
Shampoo Pantene Pro-V Restauración 400 ml ,4890
Shampoo Sedal Hialurónico y Vitamina A 340 ml ,2390
Shampoo Herbal Essences Rosa Mosqueta 400 ml ,5790
Shampoo Familand Manzana y Papaya 750 ml ,1720
Shampoo Pantene Keratina con Pro Vitamina B5 Sin Sal 300 ml ,4990
Shampoo Head & Shoulders Anti-Comezón con Menta 375 ml ,3990
Shampoo Pantene Pro-V Restauración 300 ml ,2190
Shampoo Ballerina Manzanilla 750 ml ,1850
Shampoo Familand Granada Uva 750 ml ,1752
Shampoo Dove Hidratación Intensa 400 ml ,4690
Shampoo Dove Men Fuerza Extrema 400 ml ,4490
Shampoo Ballerina Sin Sal Granada 750 ml ,1850
Shampoo Pantene Colágeno 300 ml + Bálsamo 250 ml ,7090
Shampoo Kadus Manzanilla Doypack 900 ml ,1390
Shampoo Ballerina Carbón Frasco 750 ml ,1590
Shampoo Dove Reconstrucción Completa 400 ml ,4690
Shampoo Ballerina Largo Increíble 750 ml ,1850
Shampoo Elvive Hidra Hialurónico 370 ml ,3912
Shampoo Sedal Células Madre 340 ml ,2390
Shampoo Head & Shoulders Anti-Comezón con Menta 1 L ,10190
Shampoo Fructis Aloe Hidra Bomb 350 ml ,3990
Shampoo Herbal Essences Manzanilla & Pasiflora 400 ml ,5790
Shampoo Pantene Pro-V Hidratación Extrema 300 ml ,2190
Shampoo Familand Quillay Tea Tree Oil 750 ml ,1720
Shampoo Fructis Probióticos Fuerza 350 ml ,3990
Shampoo Head & Shoulders Manzana Fresh 375 ml ,3990
Shampoo Kadus Vainilla Coco doypack 900 ml ,1590
Acondicionador Sedal Luminous UV 340 ml ,2163
Acondicionador Dove Bond Intense Repair 250 ml ,3890
Acondicionador Ballerina Reparación 750 ml ,1590
Acondicionador Elvive Glycolic Gloss 370 ml ,3912
Acondicionador Herbal Essences Suavidad Rosa Mosqueta 865 ml ,9490
Acondicionador Pantene Keratina ProVitaminaB5 Sin Sal 250 ml ,4990
Acondicionador Dove Hidratación Intensa 400 ml ,4690
Acondicionador Ballerina Manzanilla 750 ml ,1590
Acondicionador Sedal Hialurónico y Vitamina A 340 ml ,2390
Acondicionador Sedal Prebióticos + Biotina 340 ml ,2390
Acondicionador Ballerina Largo Increíble Doypack 750 ml ,1850
Acondicionador Pro-V Hidratación 300 ml ,2190
Acondicionador Herbal Essences Rosa Mosqueta 400 ml ,5790
Acondicionador Elvive Ha Pure 370 ml ,3912
Acondicionador Pantene Pro-V Restauración 400 ml ,4890
Acondicionador Familand Granada Uva 750 ml ,1752
Acondicionador Elvive Hidra Hialurónico 370 ml ,3912
Acondicionador Herbal Essences Shine 865 ml ,9490
Acondicionador Ballerina Carbón Frasco 750 ml ,1590
Acondicionador Ballerina Manzanilla 750 ml ,1850
Acondicionador Ballerina Ondas y Rizos 750 ml ,1850
Acondicionador Pantene Pro-V Restauración 300 ml ,2190
Acondicionador Kadus Vainilla Coco doypack 900 ml ,1590
Acondicionador Elvive Color Vive 370 ml ,3912
Acondicionador Ballerina Granada 750 ml ,1850
Acondicionador Fructis Adiós Esponjado 350 ml ,3192
Acondicionador Tresemmé Liso Efecto Botox 500 ml ,4290
Acondicionador Fructis Aloe Hidra Bomb 350 ml ,3990
Acondicionador Garnier Fructis Probióticos Fuerza 350 ml ,3990
Acondicionador Kadus Manzanilla Doypack 900 ml ,1390
Acondicionador Pantene Pro-V Miracles Colágeno 250 ml ,5190
Acondicionador Familand Manzana y Papaya 750 ml ,1720
Acondicionador Sedal Hialurónico + Vitamina A 190 ml ,1390
Acondicionador Baby Lee Brillitos Mágicos 400 ml ,2090
Acondicionador Sedal Colágeno y Vitamina C 340 ml ,2390
Acondicionador Herbal Essences Manzanilla & Pasiflora 400 ml ,5790
Acondicionador Pro-V rizos definidos 300 ml ,2190
Acondicionador Dove Hidra-Liso 400 ml ,4690
Acondicionador Elvive Glycolic Gloss 680 ml ,7890
Acondicionador Baby Lee Rizos y Risas 400 ml ,2090
Bolsa de Basura Home Care 70 x 90 cm 10 un. ,840
Bolsa de Basura Superior Camiseta 50 x 65 cm 10 un. ,530
Bolsa de Basura Home Care 80 x 110 cm 10 un. ,1000
Bolsa de Basura Home Care con Asas 50 x 65 cm 10 un. ,304
Bolsa de Basura Virutex Bio Mediana 70 x 90 cm 10 un. ,1000
Bolsa de Basura Home Care 70 x 90 cm 10 un. ,840
Bolsa de Basura Virutex Bio Grande 80 x 110 cm 10 un. ,1350
Bolsa de Basura Superior Rollo 50 x 70 cm 10 un. ,770
Bolsa de Basura Superior 70 x 90 cm 10 un. ,1190
Bolsa de Basura Superior Baño 45 x 55 cm 20 un. ,1450
Bolsa de Basura Virutex Bio Pequeña 50 x 70 cm 10 un. ,770
Bolsa de Basura Superior 80 x 110 cm 10 un. ,1090
Bolsa de Basura Con Asas Virutex 50 x 65 cm 10 un. ,490
Bolsa de Basura Superior Papelero 50 x 55 cm 20 un. ,1190
Bolsa de Basura Superior Cocina 60 x 65 cm 10 un. ,1450
Bolsa de Basura Basulip 50 x 70 cm 10 un. ,1000
Bolsa de Basura Superior 80 x 120 cm 10 un. ,3490
Bolsa de Basura Virutex Blanca 50 x 70 cm 10 un. ,1090
Bolsa de Basura Virutex Blanca 50 x 55 cm 20 un. ,1650
Bolsa de Basura Basulip 70 x 90 cm 10 un. ,1490
Cloro Clorox Tradicional 2 kg ,2390
Cloro Clorinda Tradicional 1 kg ,1290
Toallitas Desinfectantes Clorox Expert Bote 35 un. ,3150
Cloro Clorinda Tradicional 2 kg ,1750
Cloro Gel Clorox Menta 900 ml ,2150
Cloro Gel Cif Normal 800 ml ,1790
Cloro Gel Clorinda Menta 900 ml ,1490
Cloro Clorinda Tradicional 4 kg ,4190
Cloro Gel Clorinda Lavanda 900 ml ,1490
Cloro Máxima Tradicional 1.9 kg ,1250
Cloro Gel Cif Lavanda 800 ml ,1790
Cloro Gel Clorinda Flores Silvestres 750 ml ,1490
Cloro Gel Home Care Menta 900 ml ,1390
Cloro Ropa Clorinda Ropa Color 1.8 L ,3090
Cloro Gel Clorox Original 900 ml ,2150
Cloro Gel Igenix Tradicional 900 ml ,1950
Cloro Gel Clorinda Regular 900 ml ,1490
Cloro Gel Clorinda Lavanda Doypack 750 ml ,1490
Cloro Clorox Tradicional 4 kg ,4590
Cloro Home Care Concentrado 2 kg ,2050
Cloro Gel Clorox Pureza Cítrica 900 ml ,2150
Cloro Gel Clorinda Flores Silvestres 900 ml ,1490
Cloro Gel Excell Lavanda 900 ml ,1450
Cloro Gel Home Care Limón 900 ml ,1390
Cloro Gel Clorinda Original Doypack 750 ml ,1490
Cloro Clorox Tradicional 1 kg ,1350
Cloro Gel Home Care Tradicional 900 ml ,1390
Cloro Clorinda 500 g ,970
Cloro Impeke Concentrado Tradicional 1 kg ,1270
Cloro Máxima Tradicional 960 g ,770
Cloro Impeke Ropa Blanca 2 kg ,2450
Cloro Gel Clorox Lavanda 900 ml ,2150
Cloro Clorox Anti-Splash Botella 950 g ,1490
Cloro Gel Igenix Eucaliptus 900 cc ,1950
Cloro Home Care Concentrado 1 kg ,1250
Cloro Impeke Ropa Blanca 1 kg ,1450
Cloro Clorox Anti-Splash Botella 1900 g ,2650
Cloro Gel Igenix Lavanda 900 ml ,1950
Cloro Clorinda Lavanda 1.9 kg ,2250
Cloro Piscinas Aguacol 5 L ,3990
Toalla de Papel Nova Clásica 12 m 3 un. ,1690
Toalla de Papel Home Care Doble Hoja 100 m ,3590
Toalla de Papel Nova Ultra Doble Hoja 26 m 2 un. ,2690
Toalla de Papel Nova Gigante Doble Hoja 70 m 1 un. ,3390
Toalla de Papel Nova Gigante Doble Hoja 100 m ,4390
Toalla de Papel Home Care 26 m 2 un. ,2190
Toalla de Papel Nova Ultra 14 m 2 un. ,1590
Toalla de Papel Home Care 45 m ,1690
Toalla de Papel Nova Clásica 12 m 12 un. ,6190
Toalla de Papel Elite Deco 20 m 2 un. ,2750
Toalla de Papel Favorita Hogar Mega 100 m ,5690
Toalla de Papel Favorita Extra Hogar 2 un. 60 m ,3550
Toalla de Papel Nova Gigante Clásica 70 m ,3190
Toalla de Papel Scott Multiuso 19 m 2 un. ,3190
Servilletas Nova Clásica Cóctel 150 un. ,990
Servilletas Elite Cóctel 200 un. ,1950
Servilletas Cóctel Home Care 300 un. ,1750
Servilleta Favorita Practicas 200 un. ,1581
Servilleta Abolengo 40 un. ,410
Servilletas Elite Mesa Blanca 50 un. ,1020
Servilleta Nova Clásica Cóctel 50 un. ,400
Servilleta Mesa Home Care 200 un. ,2190
Servilletas Elite Cóctel 50 un. ,670
Servilleta de Mesa Elite 200 un. ,3450
Servilletas Nova Diseño 200 un. ,1890
Servilletas Cóctel Home Care 50 un. ,299
Servilleta Favorita Estilo Cocktail 200 un. ,2150
Servilletas de Papel Blancas Favorita 50 un. ,350
Pack 2 un. Detergente Líquido Omo Diluible 500 ml Rinde 3 L + Lavaloza 750 ml + Suavizante Soft 1 L ,14990
Detergente Líquido Omo Piel Sensible Doypack 3 L ,9190
Pack 2 un. Detergente para Preparar Omo 500 ml ,9990
Detergente Líquido Home Care Floral 5 L ,6232
Detergente Líquido Fuzol Forte Doypack 3 L ,4950
Detergente Líquido Omo Matic Ultra Power Doypack 3 L ,13690
Detergente Líquido Máxima 5 L ,4390
Detergente Polvo Omo Matic Ultra Power Bolsa 8 kg ,20150
Detergente Líquido Ariel Toque de Downy Más Perfume 1.8 L ,14690
Detergente Líquido Ariel Doble Poder Concentrado 1.8 L ,14690
Detergente Líquido Home Care Floral 3 L ,4232
Detergente Líquido Fuzol Piel Delicada Doypack 3 L ,4950
Detergente Líquido Omo Ultra Power Soft Aloe Vera Doypack 3 L ,13690
Detergente Polvo Ariel Doble Poder Ropa Blanca y de Color 5 kg ,12990
Detergente Líquido Fuzol con Suavizante Doypack 3 L ,4950
Detergente Líquido Omo Ultra Power Piel Sensible 500 ml ,5790
Detergente Líquido Igenix Higienizante 3 L ,5490
Detergente Polvo Máxima 3 kg ,4090
Detergente Líquido Rinso Hortensias y Flores Blancas Doypack 3 L ,6590
Detergente Líquido Ariel Toque de Downy Más Perfume 2.84 L ,20790
Detergente Polvo Rinso Jazmín y Violetas 8 kg ,15990
Detergente Líquido Home Care Floral 3 L ,4784
Detergente Polvo Ariel Doble Poder 2.7 kg ,7990
Detergente Líquido Omo Ultra Power Diluible 500 ml ,5790
Detergente Líquido Ariel Doble Poder Concentrado de 2.84 L ,20790
Detergente Líquido Popeye Bebé Hipoalergénico Doypack 3 L ,14290
Detergente Polvo Omo Matic Ultra Power 5 kg ,12990
Detergente en Polvo Ariel Toque de Downy 700 g ,2250
Detergente Líquido Omo Piel Sensible 3 L ,11093
Detergente Polvo Omo con Bicarbonato 2.7 kg ,8990
Detergente Líquido Rinso Doypack Mix 3 L 2 un. ,12490
Detergente Líquido Bio Frescura Bosque Nativo 3 L ,6490
Detergente Polvo Omo Matic Ultra Power Bolsa 2.7 kg ,8390
Detergente Líquido Drive Bio Enzimas Recarga 3 L ,11490
Detergente Polvo Máxima 1 kg ,1550
Detergente Polvo Rinso Hortensias y Flores 2.7 kg ,6390
Detergente Líquido Home Care Doypack 3 L ,6312
Detergente Polvo Omo Matic Ultra Power Aloe Vera Bolsa 2.7 kg ,8390
Detergente Polvo Ace 2 En 1 Manzanilla 3 kg ,7990
