Producto Encontrado,Precio
Arroz Grado 2 Maxima Grano Largo Angosto 1 kg ,1390
Arroz Grado 2 Largo y Delgado 1 kg ,1720
Arroz Grado 1 Banquete Premium Grano Largo y Ancho 1 kg ,2650
Arroz Grado 1 Grano Largo y Delgado 1 kg ,1490
Arroz Grado 2 Tucapel Blue Grano Largo y Delgado 1 kg ,1790
Arroz Grado 1 Miraflores Grano Largo y Ancho 1 kg ,2790
Arroz Grado 2 Tucapel Gran Selección Grano Largo y Ancho 1 kg ,2130
Arroz Grado 1 Tucapel Pregraneado Grano Largo 1 kg ,2470
Arroz Grado 1 Grano Largo y Ancho 1 kg ,2260
Arroz Grado 2 Miraflores Grano Largo y Laminado 1 kg ,1990
Arroz Grado 1 Tucapel Gran Selección Grano Largo y Ancho 1 kg ,2510
Arroz Grado 2 Grano Largo y Ancho 1 kg ,1790
Arroz Pregraneado 1 kg ,1790
Arroz Grado 1 Banquete Premium Grano Largo 2 kg ,4590
Arroz Integral Grado 1 Largo y Ancho 1 kg ,2320
Arroz Pregraneado Miraflores 1 kg ,2770
Arroz Grado 1 Tucapel Grano Largo Delgado 1 kg ,2410
Arroz Preparado Miraflores Chaufan 210 g ,1150
Arroz Grado 1 Grano Largo y Ancho 3 kg ,6160
Arroz Preparado Primavera 210 g ,1150
Arroz Especial Tucapel Basmati Pregraneado1 kg ,5440
Arroz Preparado Miraflores Campesino 210 g ,1150
Arroz Grado 2 Banquete Premium Grano Largo y Ancho 1 kg ,2050
Arroz Basmati Tucapel 400 g ,2340
Arroz Grado 2 Tucapel Grano Largo y Ancho Graneado 1 kg ,2190
Arroz Preparado Miraflores Paella 175 g ,1150
Arroz Especial Tucapel Preparado Curry Champiñón Sobre 210 g ,970
Arroz Grado 1 Tucapel Integral 1 kg ,2840
Arroz Basmati Miraflores 400 g ,2960
Arroz Preparado Miraflores Champiñon 210 g ,1150
Arroz Grado 1 Iansa Agro Gran Selección 1 kg ,2550
Arroz Preparado Miraflores Curry 210 g ,1150
Arroz Risotto Miraflores 400 g ,2210
Arroz Sushi Tucapel 400 g ,1450
Arroz Paella 400 g ,2090
Arroz Grado 2 Iansa Agro 1 kg ,2250
Fideos de Arroz Exotic Food 3 mm Bolsa 250 g ,1043
Sazonador Gourmet para Arroz 6 un. ,810
Pasta Spaghetti N°5 Carozzi 400 g ,1050
Pasta Espiral N°49 Carozzi 400 g ,1050
Pasta Corbata N°80 Carozzi 400 g ,1050
Pasta Tallarin N°87 Carozzi 400 g ,1050
Pasta Mostaccioli N°46 Carozzi 400 g ,1050
Pasta Quifaro N°36 Carozzi 400 g ,1050
Pasta de Maní Natural King 485 g ,3790
Pasta Fettuccine N°88 Carozzi 400 g ,1050
Pasta Rigatoni N°48 Carozzi 400 g ,1050
Pasta Spaghetti N°5 Trattoria 400 g ,975
Pasta Fusilli Trattoria 400 g ,975
Pasta Tallarines N°87 Carozzi Espinaca 400 g ,1170
Pasta Spaghetti N°3 Carozzi 400 g ,1050
Pasta Capellini N°25 Carozzi 400 g ,1050
Pasta Salame Receta del Abuelo 125 g ,990
Pasta Fusilli Tricolor Carozzi 400 g ,1170
Pasta Fettuccini N°88 Trattoria 400 g ,975
Pasta de Mani King 245 g ,2590
Pasta Spaghetti Tricolor Carozzi 400 g ,1170
Pasta Spaghetti N°5 Vivo 350 g ,1220
Pasta Pollo Ciboulette La Preferida 125 g ,1150
Pasta Ave Mayo Receta del Abuelo 125 g ,1350
Pasta Rigati Lucchetti Tr3S Vegetales 400 g ,1120
Pasta Spaghetti Cuadrado La Molisana 500 g ,1890
Pasta Caracol N°55 Carozzi 400 g ,1050
Pasta Fusilli La Molisana 500 g ,1890
Pasta Sabor Jamón Serrano Recetas Del Abuelo 125 g ,990
Pasta de Mani King Crunch 350 g ,3290
Pasta Ave Pimentón La Preferida 125 g ,1150
Pasta Penne La Molisana 500 g ,1890
Pasta de Arroz Spaguetti Tucapel 250 g ,1890
Pasta Spaghetti N°5 Carozzi 1 kg ,2560
Pasta Salame La Preferida 125 g ,1150
Pasta de Arroz Rigati Tucapel 250 g ,1890
Pasta de Fetuccini Edamame 200 g ,4980
Spaghetti N°5 Lucchetti 400 g ,990
Spaghetti N° 5 Máxima 400 g ,530
Fideos Mostaccioli Lucchetti 400 g ,990
Espirales Máxima 400 g ,530
Espirales Proslow Lucchetti 400 g ,990
Porotos Blancos Wasil 230 g drenado ,1450
Porotos Blancos Banquete 1 kg ,3960
Porotos Blancos Iansa Agro Listos 390 g ,1450
Porotos Blancos 230 g drenado ,1270
Porotos Blancos Iansa Agro 1 kg ,3850
Manzana Fuji Importada Granel (2 a 3 un. Aprox) ,1245
Manzana Verde Granel ,1245
Manzana Royal Gala Granel ,1245
Manzana royal gala 1 kg ,1290
Manzana verde bolsa 1 kg ,1290
Compota Nestlé Manzana 120 g ,479
Yogurt Soprole Proteína Kiwi Plátano Manzana 155 g ,789
Probiótico Uno Manzana 80 ml ,3700
Bebida Láctea Probióticos Sin Lactosa Surlat Manzana 4 un. ,1379
Pack 18 un. Bebida Láctea Chamyto Manzana Multipack 80 ml ,6479
Multipack 6 un. Yogurt Probiótico Chamyto Manzana 80 ml ,2579
Compota Soprole Manzana 110 g ,469
"Yogurt Nestlé Goodnes Trozos Manzana, Ciruela y Chía 140 g ",729
Leche Colun Prisma Manzana Avena 330 ml ,890
Palta Hass Malla 1 kg ,2990
Palta Hass Extra Chilena (1 a 2 un. Aprox) ,2995
Sal Fina Cuisine & Co 1 kg ,480
Sal de Mar Fina 1 kg ,990
Sal Lobos Fina 1 kg ,550
Sal Lobos de Selección Yodada 125 g ,630
Sal Lobos de Selección Yodada Frasco 500 g ,1440
Sal de Mar Lobos Entrefina 800 g ,1930
Sal Biosal Light Pote 850 g ,3950
Sal Lobos Gruesa de Cocina 1 kg ,620
Sal de Mar Lobos Fina 900 g ,1580
Sal Parrillera 750 g ,990
Sal Lobos Fina de Mesa Pote 850 g ,1570
Sal de Mar Fina 800 g ,1670
Sal Lobos de Selección Yodada Frasco 250 g ,920
Sal Parrillera Lobos Yodada Frasco 750 g ,1630
Sal de Mar Lobos Extra Gruesa 800 g ,2200
Sal Rosada Los Boldos Fina Doypack 1 kg ,3830
Sal Fina Cuisine & Co 1 kg ,780
Sal Rosada Los Boldos Gruesa Doypack 1 kg ,3830
Sal del Himalaya Los Boldos Parrillera Doypack 1 kg ,3790
Sal de Mar Lobos Parrillera 380 g ,1860
Sal Rosada Gourmet del Himalaya Molinillo 105 g ,4430
Sal Rosada Los Boldos Molinillo 200 g ,6999
Sal Himalaya Cuisine & Co 90 g ,3384
Sal Himalaya Merquén 90 g ,3384
Mantequilla Colun Con Sal 250 g ,3279
Mantequilla Soprole Con Sal 250 g ,2490
Mantequilla Calo Con Sal 250 g ,3149
Margarina Qualy Con Sal 500 g ,2669
Mantequilla Colun Con Sal 125 g ,1490
Mantequilla Soprole Sin Sal 250 g ,3299
Mantequilla Surlat Con Sal 200 g ,2399
Mantequilla Calo Con Sal Untable 350 g ,5099
Mantequilla Soprole Con Sal 125 g ,1669
Mantequilla Rumay Con Sal 200 g ,3069
Mantequilla Colun Sin Sal 250 g ,3499
Mantequilla Sin Lactosa Surlat con Sal 200 g ,2490
Mantequilla Los Alerces Con Sal 250 g ,3399
Margarina Qualy Con Sal 1 kg ,4090
Mantequilla Soprole Con Sal de Mar 250 g ,3649
Azúcar Blanca Iansa 900 g ,1339
Azúcar Máxima 1 kg ,1130
Azúcar Blanca Iansa 1 kg ,1470
Azúcar Rubia Iansa 500 g ,1370
Azúcar Cuisine & Co Blanca Granulada 1 kg ,1270
Azúcar Cuisine & Co 900 g ,990
Azúcar Blanca Iansa 5 kg ,6290
Azúcar Flor Iansa 500 g ,1270
Azúcar Rubia Cuisine & Co 1 kg ,1990
Azúcar Cuisine & Co 1.3 kg ,1860
Azúcar Flor Cuisine & Co 500 g ,920
Azúcar Rubia Iansa 1 kg ,2670
Azúcar Blanca Iansa Light con Sucralosa 500 g ,1670
Azúcar Light Cuisine & Co Con Stevia 500 g ,1272
Azúcar Cuisine & Co 5 kg ,6170
Azúcar Sucralosa Cuisine & Co Light 500 g ,1160
Azúcar Blanca Iansa 3 kg ,5130
Azúcar Rubia Cuisine & Co 500 g ,1160
Chancaca Deliciosa 400 g ,2590
Azúcar Blanca Iansa Light con Stevia 500 g ,1820
Chancaca Deliciosa 200 g ,1390
Panela Alejandria Granulada 400 g ,2950
Chancaca Iansa 450 g ,2390
Panela Alejandria En Bloque 500 g ,2750
Azúcar Light Cuisine & Co Con Sucralosa 1 kg ,2850
Azúcar Stevia Cuisine & Co Light 1 kg ,3150
Aceite Vegetal Libre de Colesterol 900 ml ,1490
Aceite de Maravilla 900 ml ,2430
Aceite Vegetal Miraflores 900 ml ,2790
Aceite de Maravilla Chef 1 L ,2490
Aceite Vegetal 900 ml ,1590
Aceite Vegetal Belmont 1 L ,3160
Aceite 100% vegetal 5 L ,8590
Aceite de Oliva Banquete Extra Virgen 500 ml ,10490
Aceite de Oliva Chef Extra Virgen 500 ml ,10490
Aceite de Maravilla 900 ml ,2430
Aceite de Oliva Giada Extra Virgen 1 L ,11590
Aceite Vegetal 900 ml ,1490
Aceite de Maravilla Natura 900 ml ,3550
Aceite de Canola 1 L ,2790
Aceite de Oliva Banquete Extra Virgen 1 L ,18190
Aceite de Maravilla Miraflores 900 ml ,3150
Aceite de Oliva Chef Extra Virgen 1 L ,15990
Aceite de Oliva Giada 500 ml ,6990
Aceite Vegetal Natura 900 ml ,2790
Aceite de Oliva Talliani Tradizione 1 L ,17990
Aceite de Oliva Extra Virgen 1 L ,17890
Aceite de Oliva Huasco Extra Virgen 500 ml ,11850
Aceite de Pepita de Uva Chef 1 L ,7359
Aceite de Oliva Extra Virgen 500 ml ,10190
Aceite de Oliva Olitalia Extra Virgen 500 ml ,10490
Aceite de Coco Mi Tierra 350 g ,9390
Aceite de Oliva Huasco Extra Virgen 2 L ,34990
Aceite de Oliva Banquete Extra Virgen 250 ml ,6850
Aceite de Oliva Montecristo Maravilla 500 ml ,5007
Aceite de Oliva Huasco Extra Virgen 1 L ,21690
Aceite de Oliva Terra Santa Extra Virgen 500 ml ,9630
Aceite de Oliva con Maravilla Chef 1 L ,11490
Aceite de Maravilla Natura Libre de Colesterol 1.5 L ,6090
Aceite de Oliva Virgen 500 ml ,9590
Aceite de Oliva Talliani Tradizione 500 ml ,10890
Aceite de Oliva Kardámili Clásico Extra Virgen 500 ml ,9890
Aceite de Oliva Chef Libre de Colesterol 1 L ,16790
Aceite de Oliva La Española Extra Virgen 250 ml ,6190
Huevos Yemita Blancos Grandes 12 un. ,3419
Huevos Cintazul Grandes Blancos 12 un. ,3919
Huevos Cuisine & Co Extra Grandes Blanco 20 un. ,6349
Huevos Cuisine & Co Grandes Blancos 12 un. ,3049
Huevos Yemita Medianos Extra Blancos 30 un. ,7590
Huevos Extra Blanco Santa Marta 20 un. ,6690
Huevos Santa Marta Grandes Blancos 12 un. ,3669
Huevos Santa Marta Grandes Blancos 6 un. ,1849
Huevos Cuisine & Co Medianos Blancos 30 un. ,8199
Huevos Yemita Extra Blanco 18 un. ,5599
Huevos Cintazul Extra Blancos 12 un. ,3999
Huevos Santa Marta Extra Blancos 12 un. ,3949
Huevo de chocolate blanco Bon o Bon 55 g ,2590
Jamón Sándwich San Jorge Granel ,572
Jamón sándwich granel ,636
Jamón Sándwich La Crianza Granel ,796
Jamón Sándwich Cerdo La Preferida kg ,956
Jamón Sándwich Cerdo San Pablo Granel ,516
Fiambre Jamón Sándwich San Jorge 250 g ,1890
Queso Gauda Cuisine & Co Envasado Laminado 500 g ,4790
Queso Gauda Sin Lactosa Cuisine & Co Envasado Laminado 250 g ,2990
Queso Gauda Colun Laminado Granel ,1240
Queso Gauda Soprole Envasado Laminado 500 g ,6299
Queso Gauda Soprole Laminado Granel ,1000
Queso Mantecoso Río Bueno Laminado Granel ,1304
Queso Mantecoso Soprole Quilque Trozo Granel ,1072
Queso Mantecoso Las Parcelas de Valdivia Trozo Granel ,1120
Queso Gauda Cuisine & Co Laminado Granel ,916
Queso Crema Cuisine & Co Envasado 226 g ,2490
Queso Mantecoso Quilque Laminado Granel ,1020
Queso Reggianito Colun Rallado 40 g ,1079
Queso Mantecoso Matthei Laminado Granel ,1496
Queso Mantecoso Río Bueno Laminado 500 g ,7329
Queso Gauda Calo Laminado Granel ,1148
Queso Reggianito Colun Rallado 80 g ,2099
Queso Mantecoso Quilque Envasado Laminado 500 g ,5499
Queso Gauda Soprole Envasado Laminado 250 g ,3599
Queso Mantecoso Matthei Trozo Granel ,1456
Queso Chanco Quillayes Laminado Granel ,1120
Queso Mantecoso Río Bueno Trozo Granel ,1104
Queso Mantecoso Las Parcelas de Valdivia Laminado Granel ,1700
Queso gauda ranco barra kg ,1080
Queso Parmesano Cuisine & Co Envasado Rallado 40 g ,650
Queso Gauda Soprole Envasado Laminado 500 g ,6679
Queso Crema Cuisine & Co Envasado 227 g ,2490
Queso Cheddar Alerces Laminado 160 g ,1949
Queso Fresco Light Sin Lactosa 400 g ,2949
Queso Mantecoso Matthei Envasado Laminado 250 g ,4159
Queso Crema Philadelphia Envasado 150 g ,2199
Queso Parmesano Colun Envasado Rallado 80 g ,1629
Queso Chacra Quillayes Envasado Trozo 400 g ,3269
Queso Mantecoso Kastanon Trozo Granel ,932
Queso Gauda Ranco Colun Laminado 500 g ,6589
Queso Crema Philadelphia Envasado 180 g ,3699
Queso Fresco Colun 450 g ,3129
Queso Mantecoso Cuisine & Co Laminado 500 g ,6249
Queso Chanco Quillayes Envasado Laminado 500 g ,6889
Queso Crema Soprole Envasado 200 g ,1549
Queso Crema Colun Envasado 100 g ,699
Mantequilla Colun Con Sal 250 g ,3279
Mantequilla Soprole Con Sal 250 g ,2490
Mantequilla Calo Con Sal 250 g ,3149
Mantequilla Colun Con Sal 125 g ,1490
Mantequilla Las Parcelas de Valdivia 200 g ,2999
Mantequilla Soprole Sin Sal 250 g ,3299
Mantequilla Surlat Con Sal 200 g ,2399
Mantequilla Calo Con Sal Untable 350 g ,5099
Mantequilla Colun 200 g ,3569
Mantequilla Soprole Con Sal 125 g ,1669
Mantequilla Rumay Con Sal 200 g ,3069
Mantequilla Soprole Untable Pote 350 g ,5949
Mantequilla de Maní American Classic Crocante 510 g ,2399
Mantequilla Colun Sin Sal 250 g ,3499
Mantequilla Soprole Untable Pote 200 g ,3959
Mantequilla Sin Lactosa Surlat con Sal 200 g ,2490
Mantequilla Los Alerces Con Sal 250 g ,3399
Mantequilla 125 g ,1669
Mantequilla Soprole Con Sal de Mar 250 g ,3649
Mantequilla Kumey de Campo 250 g ,3499
Mantequilla Soprole Receta de Campo 250 g ,3239
Mantequilla Futaleufú Artesanal 250 g ,3439
Mantequilla Calo Con Sal 125 g ,1789
Mantequilla Quillayes con Sal 200 g ,2790
Mantequilla Ecoterra Con Sal Vacas Libre Pastoreo 250 g ,4529
Salsa de Tomate Pomarola 200 g 6 un. ,4060
Salsa de Tomate Malloa Italiana 200 g 6 un. ,3490
Salsa de Tomates Lucchetti Italiana Pack 6 un. ,3000
Salsa de Tomate Pomarola Natural 200 g ,700
Salsa de Tomate Carozzi Toscana Bolognesa 200 g ,960
Salsa de Tomate Maggi Tuco Con Carne 245 g ,1650
Salsa de Tomate Pomarola Italiana 200 g ,700
Salsa de Tomate Maggi Tuco con Carne 980 g ,5970
Salsa de Tomate Doña Clara Italiana 200 g ,780
Salsa de Tomate Pomarola Casera 200 g ,920
Salsa de Tomate Carozzi Toscana Al Pesto 200 g ,960
Salsa de Tomates Lucchetti Italiana Doypack 200 g ,780
Salsa de Tomates Mamma Mia Boloñesa Doypack 200 g ,930
Salsa de Tomate Maggi Tuco Sabor Albahaca 245 g ,1650
Salsa de Tomate Maggi Tuco con Pollo 245 g ,1650
Salsa de Tomates Mamma Mia napolitana doypack 200 g ,930
Salsa de Tomate Mutti para Pizza 400 g ,2890
Salsa de Tomate Carozzi Toscana Arrabbiata 200 g ,960
Salsa de Tomate Malloa Italiana 200 g ,860
Salsa de tomates 200 g ,850
Salsa de Tomates Lucchetti A La Albahaca 200 g ,890
Puré de Tomate Mutti 400 g ,1699
Puré de Tomate Mutti Passata 700 g ,3790
Pure Tomate Passata La Molisana 690 g ,2890
Pack Ahorro Salsa de Tomate Aconcagua 6 un. ,3450
Puré de Tomate Mutti Passata Al Basilico 700 g ,3790
Sopa Maggi Pollo Fideos 70 g ,610
Sopa Maggi Pollo con Sémola 68 g ,610
Sopa Maggi Sabor Pollo con Arroz 70 g ,610
Sopa Maggi Consomé Familiar Pollo 50 g ,610
Sopa Individual Gourmet Consomé de Pollo 15 g ,480
Sopa Pollo Fideos 70 g ,500
Sopa Naturezza Pollo Fideos 55 g ,510
Sopa Maggi Vive Bien Pollo con Fideos 60 g ,740
Sopa para Uno Maggi Pollo Merkén 16 g ,480
Sopa Maggi para Uno Consomé de Pollo 12 g ,480
Crema Pollo Cuisine & Co 72 g ,530
Sopa para Uno Maggi Pollo Fideo 16 g ,480
Sopa Pollo Con Fideos Gourmet 70 g ,580
Sopa Pollo Fideo Natural 60 g ,740
Comida Instantánea Maruchan Pollo Sobre 85 g ,720
Caldo Gourmet Polvo Sabor Pollo 6 un. ,810
Caldo Maggi Sabor Pollo de Campo 80 g 8 Tabletas ,1220
Fideos Instantáneos Traverso Sachet Pollo 85 g ,630
Carne Molida Vacuno 10% Grasa 320 g ,3990
Carne Molida Vacuno 4% Grasa 320 g ,4990
Carne Molida Vacuno 10% Grasa Congelada 500 g ,5190
Carne Molida Vacuno 7% Grasa 320 g ,4390
Carne Molida Vacuno 4% Grasa Congelada 500 g ,6590
Posta Rosada kg ,16485
Sobrecostilla Cat. V ,10387
Posta Paleta Cat. V ,15824
Choclillo Cat. V kg ,10439
Asiento Cat. V ,14839
Lomo Vetado granel kg ,20985
Lomo Liso Cat. V ,16887
Huachalomo Cat. V ,11985
Asado del Carnicero Al Vacío kg ,11985
Ganso Cat. V ,14384
Punta Paleta Al Vacío kg ,16983
Tapapecho Cat. V ,10485
Escalopa Posta Negra Vacuno kg ,3938
Bistec de Posta Rosada kg ,5907
Abastero Cat. V ,11985
Posta Negra granel kg ,17584
Bistec de Posta Paleta kg ,5457
Pollo ganso cat V vacío kg ,22580
Bistec de Posta Negra kg ,5907
Arrachera Americana Brawley Al Vacío kg ,16792
Filetitos de Pechuga Congelado 700 g ,5490
Filetitos de Pollo Deshuesados y Sin Piel 530 g ,3890
Filetitos de Pollo 830 g ,5890
Filetillos de Pollo Ariztía 650 g ,5190
Filetitos de Pollo La Crianza 400 g ,4990
Filetitos de Pollo Super Pollo 530 g ,4190
Avena Instantánea Cuisine & Co 750 g ,1850
Avena Instantánea Vivo 800 g ,2399
Avena Instantánea Quaker 700 g ,2659
"Granola Quaker Avena, Miel y Almendras 320 g ",2519
Granola Cuisine & Co Almendra Miel 370 g ,2249
Avena Instantánea Cuisine & Co 450 g ,1779
Avena Tradicional Cuisine & Co 750 g ,1850
Granola Vivo Berries 330 g ,2529
Granola Cuisine & Co Chocolate 370 g ,2249
Avena Tradicional Quaker 700 g ,2659
Granola Vivo Miel & Almendras 330 g ,2529
Avena Tradicional Cuisine & Co 450 g ,1779
Granola Wild Protein Crunchy Mix 300 g ,5469
Granola En Línea Almendra 320 g ,2799
Muesli Viola Chocolate Bolsa 1 kg ,4990
Avena Integral The Power Of Foods 1 kg ,6190
Granola En Línea Cranberries 320 g ,2799
Muesli Viola Cinco Frutas Bolsa 1 kg ,4990
Avena Integral Quaker Multisemillas ,3619
Avena Integral Quaker Multisemillas 600 g ,3619
Avena Instantánea Quaker 400 g ,2049
Granola Proteica Underfive Almendra Crunch 300 g ,6990
Muesli Viola Clásico Bolsa 1 kg ,4990
Muesli Viola Uva Bolsa 1 kg ,4990
Avena Tradicional Quaker 400 g ,2049
Cereal Orgánico Pacari Chocolate 250 g ,5790
Pack 6 un. Leche Semidescremada Soprole con Avena 200 ml ,3054
Leche Semidescremada Soprole con Avena 1 L ,1300
Leche Semidescremada Soprole con Avena 200 ml ,509
Leche Semidescremada Soprole con Avena Chocolate 1 L ,1300
Bebida Vegetal Avena Original 1 L ,2369
Yogurt Soprole con Avena 155 g ,519
Bebida Vegetal Loncoleche Avena 1  L ,2729
Pack 6 un. Leche Semidescremada Chocolate Soprole con Avena 200 ml ,3294
Yogurt Soprole Proteína con Avena 155 g ,789
Leche Colun Prisma Chocolate Avena 330 ml ,890
Bebida Vegetal Orasi Avena Protein 1 L ,3219
Leche Semidescremada Chocolate Soprole con Avena 200 ml ,549
Leche Colun Prisma Manzana Avena 330 ml ,890
Bebida Vegetal Orasi Avena Fibra 1 L ,3219
Pan Molde Castaño Blanco XL Sin Lactosa 770 g ,2949
Pan Molde Ideal Blanco XL 750 g ,2949
Pan Molde Castaño Integral XL 770 g ,2949
Pan de Molde Cena Blanco XL 740 g ,1990
Pan Molde Fuchs Multigrano 620 g ,2949
Pan Molde Fuchs Calabaza Nuez 600 g ,2949
Pan Molde Ideal Cero Cero Integral 600 g ,2889
Pan Molde Castaño Miga Sándwich Sin Borde 440 g ,3549
Pan Molde Fuchs Linaza Chia 600 g ,2949
Pan Molde Ideal Blanco Artesano Masa Madre 550 g ,2889
Pan Molde Castaño Linaza 600 g ,2290
Pan Molde Castaño Multigrano 600 g ,2290
Pan Molde Ideal Cero Cero Blanco 580 g ,2889
Pan Molde Kingsbury Perfecto 580 g ,3689
Pan Molde Castaño Integral Linaza 400 g ,2249
Pan Pita Ideal Blanco 344 g 8 un. ,1749
Pan Molde Castaño Integral 400 g ,1689
Pan Molde Familiar Integral 580 g ,2229
Pan Molde Castaño Granos Ancestrales 650 g ,2290
Pan Molde Ideal Integral Artesano 600 g ,2789
Pan Molde Castaño Blanco 400 g ,1689
Pan Molde Kingsbury Perfecto Dúo 580 g ,3689
Pan Molde Kingsbury Hi Low 500 g ,3429
Pan Molde La Selecta Blanco Familiar 580 g ,2229
Pan Molde Castaño Miga Dúo 440 g ,3789
Pan Molde Fuchs Multigrano 350 g ,2349
Pan Pita Ideal Blanco Cero Cero 8 un. ,1749
Pan Molde Fuchs Linaza Chia 350 g ,2349
Pan Molde Castaño Dúo XL 760 g ,2949
Pan Molde Bauducco Integral 390 g ,1949
Pan Molde Fuchs Calabaza Nuez 350 g ,2349
Pan Molde Pan Pierre Integral 580 g ,2649
Pan Pita Ideal Blanco Light 300 g 8 un. ,1749
Pan Molde Bauducco Blanco 390 g ,1949
Pan Molde Ideal Blanco Sándwich 700 g ,3849
Pan Molde Castaño Multigrano 400 g ,2249
Jurel Al Natural San José Lata 300 g drenado ,1990
Jurel Al Natural 300 g drenado ,1820
Jurel al Agua Coliseo 235 g drenado ,1190
Jurel de Reyes 230 g drenado ,1190
Jurel Al Natural Deyco 255 g drenado ,1190
Lomos de Jurel Natural San José 104 g drenado ,1190
Lomos de Jurel Ahumado San José 104 g drenado ,1190
Jurel Natural 130 g drenado ,1370
Lomos de Jurel En Aceite San José 104 g drenado ,1190
Jurel En Salsa de Tomate 300 g drenado ,2149
Jurel Natural Bajo En Sodio 300 g drenado ,2149
Jurel En Salsa de Tomate 130 g drenado ,1249
Jurel Al Natural San José Reducido En Sodio 300 g drenado ,2670
Café Gold Premier Liofilizado Arábica Frasco 170 g ,8890
Café Nescafé Tradición 170 g ,5490
Café Nescafé Fina Selección 200 g ,11350
Café Nescafé Dolca 170 g ,4850
Café Nescafé Tradición 170 g ,8490
Café Nescafé Tradición 50 g ,2850
Café Instantáneo Cuisine & Co 150 g ,3490
Café Gold Descafeinado 170 g ,5630
Café Gold Primera Selección 170 g ,5450
Café Nescafé Decaf Tarro 170 g ,7690
Café Liofilizado Marley Coffee Wake Up & Live 100 g ,5990
Café Nescafé Doble Choca Moka 184g (8 un. x 23 g) ,3150
Café Nescafé Mixes Cappuccino 8 Un. ,3150
Café Gold Premier Clásico Frasco 170 g ,6890
Café Liofilizado Cuisine & Co 190 g ,7490
Café Monterrey Clásico 170 g ,4250
Café Gold Premier Forte Molido 250 g ,5100
Café Nescafé Vainilla Latte 148g (8 un. x 18.5 g) ,3150
Café Molido Daroma Mezcla Forte 250 g ,3350
Café Gold Premier Excelso Molido 250 g ,5100
Café Liofilizado Cruzeiro 170 g ,7750
Café Molido Daroma 100% Puro Café Excelso 250 g ,3350
Café Gold Premier Liofilizado 170 g ,6530
Café Sobres Gold Tentaciones Choco Moka 19 g 8 un. ,2990
Café Grano Monterrey Molido 250 g ,4650
Café Grano Monterrey Molido Moka 250 g ,4550
Café Sobres Gold Tentaciones Vainilla 19 g 8 un. ,2990
Café Molido Haiti Super Moka 3 Bolsa 250 g ,4449
Café Colombiano Cuisine & Co Intenso Tostado y Molido 250 g ,7490
Café Cápsulas Cuisine & Co Classico 10 un. ,4590
Café Gold Descafeinado 100 g ,4890
Café Liofilizado Cuisine & Co Descafeinado 190 g ,9190
Café Cápsulas Cuisine & Co Forte 10 un. ,4590
Café Sobres Gold Tentaciones Caramelo 22 g 8 un. ,2990
Café Nescafé Fina Selección 50 g ,3650
Café Cappuccino Krüger Vainilla 150 g ,3690
Café Cápsulas Cuisine & Co Avellana 10 un. ,4590
Café Orgánico Marley Coffee Liofilizado Positive Vibration 100 g ,10990
Café Nescafé Fina Selección 100 g ,8890
Café Nescafé Decaf Tarro 100 g ,5950
Té Ceylán Supremo Premium 200 g 100 un. ,4490
Té Negro Lipton Yellow Label 100 un. ,5590
Té Ceylán Mildred Tea Caja 100 Bolsitas 200 g ,3350
Té Ceylán Supremo Mystic 80 Bolsitas ,3790
Té Negro Supremo Premium 100 g 50 un. ,2990
Té En Hojas Superior Ceylán Bolsa 250 g ,3450
Té Negro Ceylon Dilmah Premium 100 Bolsitas ,5490
Té Ceylán Supremo Oro 50 Bolsitas ,1790
Té Ceylán Supremo Express Caja 200 g 100 un. ,3950
Té Ceylán Mildred Tea Bolsa 250 g ,2850
Té Ceylán Supremo En Hojas Bolsa 250 g ,2950
Té Ceylán Supremo Mystic 50 Bolsitas ,2550
Té Ceylán Canela Supremo Aromatizado Caja 40 g 20 Bolsas ,1850
Té negro original 100 bolsas ,2549
Té Verde Supremo Premium 50 Bolsas ,4150
Té Ceylán Supremo Premium Doble Cámara Caja 40 g 20 un. ,1590
Té Ceylán Supremo Manzana y Canela Caja 40 g 20 un. ,1750
Té Negro Emblem Tea Ceylon Blend Original 100 Bolsas ,2250
Té Supremo Luxury 80 Bolsitas ,5590
Té Ceylán Supremo Naranja Caja 40 g 20 un. ,2050
Té Negro Supremo Chai Supremo 20 Bolsitas ,2690
Té Verde Supremo Aromatizado Con Limón 40 g 20 Sobres ,1850
Té Ceylán Supremo Línea Oro Caja 200 g 100 un. ,4190
Té Orjas En Polvo Canela 30 g ,1290
Té Superior Ceylon Puro 125 g ,1990
Té Club Ceylán Premium Sobre Envoltura 100 un. ,3000
Té Orjas En Polvo 30 g ,1290
Té Verde Chino 20 Bolsas ,1440
Té Ceylán Mildred Tea Caja 40 g 20 Bolsas ,990
Té Earl Grey Twinings 50 Bolsitas ,8150
Té Verde Supremo Premium 40 g 20 Bolsitas ,1750
Té English Breakfast Twinings 50 Bolsitas ,8150
Té Chai Latte Krüger Classic India Vainilla Chocolate 100 g 10 un. ,3790
Té Club Negro Premium 100 Bolsitas ,3799
Té Negro Lipton Yellow Label 50 un. ,4250
Té Negro Ceylon Dilmah Premium 20 Bolsitas ,2450
Té Matcha Manare Orgánico 50 g ,5790
Té Orjas En Polvo Limón ,1290
Té Early Grey English Tea Shop 8 Bolsitas ,1890
Te Matcha Latte Krüger Coco 25 g 10 un. ,3790
Yogurt Batido Soprole Frutilla 120 g ,289
Yogurt Batido Calán Semidescremado Frutilla 110 g ,275
Yogurt Batido Soprole Vainilla 120 g ,289
Yogurt Batido Colun Frutilla 125 g ,309
Yogurt Batido Colun Vainilla 125 g ,309
Yogurt Batido Calán Semidescremado Chirimoya 120 g ,275
Yogurt Batido Soprole Plátano 120 g ,289
Yogurt Batido Colun Vainilla 1 kg ,1939
Yogurt Batido Colun Frambuesa 1 kg ,1939
Yogurt Batido Colun Mora 125 g ,309
Yogurt Batido Soprole Damasco 120 g ,289
Yogurt Batido Colun Damasco 125 g ,309
Yogurt Batido Colun Frutilla 1 kg ,1939
Yogurt Batido Colun Frambuesa 125 g ,309
Yogurt Batido Soprole Frambuesa 120 g ,289
Yogurt Batido Soprole Mora 120 g ,289
Yogurt Batido Colun Mora 1 kg ,1939
Yogurt Batido Colun Damasco 1 kg ,1939
Yogurt Batido Nestlé Frutilla 115 g ,289
Yogurt Batido Soprole Frutilla Bolsa 1 kg ,1869
Yogurt Batido Calán Chirimoya 1 kg ,1429
Yogurt Batido Calán Frutilla 1 kg ,1429
Yogurt Batido Light & Free Frutilla 900 g ,1989
Yogurt Batido Loncoleche Sin Lactosa Chirimoya Bolsa 900 g ,2199
Yogurt Batido Soprole Vainilla Bolsa 1 kg ,1869
Yogurt Batido Calán Vainilla 1 kg ,1429
Yogurt Batido Light & Free Arándano 115 g ,359
Yogurt Batido Nestlé Vainilla 115 g ,289
Yogurt Kéfir Soprole Batido Berries 155 g ,455
Yogurt Batido Light & Free Natural Endulzado 115 g ,359
Yogurt Batido Loncoleche Sin Lactosa Vainilla Bolsa 900 g ,2199
Yogurt Batido Light & Free Frutilla 115 g ,359
Yogurt Batido Soprole Chirimoya 165 g ,535
Yogurt Batido Soprole Frutilla Botella 1 L ,2549
Yogurt Batido Soprole Vainilla Botella 1 L ,2549
Yogurt Batido Light & Free Vainilla 115 g ,359
Yogurt Batido Soprole Damasco Bolsa 1 kg ,1869
Yogurt Batido Soprole Frutilla 165 g ,535
Yogurt Batido Nestlé Damasco 115 g ,289
Gelatina Vivo Sin Azúcar Berries 22 g ,690
Gelatina Vivo Sin Azúcar Piña 22 g ,690
Gelatina Frambuesa 100 g ,623
Gelatina Vivo Sin Azúcar Naranja 22 g ,690
Gelatina Sin Sabor 30 g ,863
Gelatina Caricia Sabor Frambuesa 50 g ,860
Gelatina Piña 100 g ,623
Gelatina Frutilla 100 g ,623
Gelatina Ambrosoli Cereza 100 g ,949
Gelatina Naranja 100 g ,623
Flan Vivo Sin Azúcar Vainilla Con Caramelo 80 g ,890
